NOMREG;NOMDEP;VILLE;NOM DU MUSEE;ADR;CP;ANNREOUV;FERME;SITWEB;FERMETURE ANNUELLE;PERIODE OUVERTURE;;;;;;;;;;
cx;wx;qs;za;re;ds;df;NON;ds;ez;ds
cx;wx;BETSCHDORF;Musee de la Poterie;2, rue de Kuhlendorf;67660;;NON;www.betschdorf.fr/tourisme/visiter_betschdrof/musee_poterie.php;11/11,01/12-01/04;
cx;wx;BOUXWILLER;Musee de Bouxwiller et du Pays de Hanau;2, Place du Château Halle aux Bles;67330;2016OUI;OUI;www.musee-pays-hanau.webmuseo.com;11/11,01/12-01/04;
cx;wx;HAGUENAU;Musee Alsacien;1, place Joseph Thierry;67500;;NON;www.ville-haguenau.fr/pages/culture/musee.htm;;
cx;wx;HAGUENAU Cedex;Musee Historique;9, Rue du Marechal Foch B.P. 40261;67504;;NON;www.ville-haguenau.fr/pages/culture/musee.htm ou www.museumspass.com/dn_musees-haguenau/;;
cx;wx;MOLSHEIM;Musee de la Chartreuse;4, Cour des Chartreux;67120;;NON;www.chartreuse-molsheim.info;24/12,25/12;
cx;wx;NIEDERBRONN-LES-BAINS;Maison de l'Archeologie des Vosges du Nord;44, Avenue Foch;67110;;NON;www.musee-niederbronn.fr;;
cx;wx;PFAFFENHOFFEN;Musee de l'Image Populaire de Pfaffenhoffen;24, rue du Docteur Albert Schweitzer;67350;;NON;www.pfaffenhoffen.org ou http://webmuseo.com/ws/musee-image-populaire/app/report/index.html;;
cx;wx;REICHSHOFFEN;Musee du Fer;9, rue Jeanne d'Arc;67110;;NON;www.lacastine.com;;
cx;wx;SAVERNE;Musee du Château des Rohan;Château des Rohans Place du General de Gaulle;67700;;NON;http://www.louise weiss.org;24/12,25/12;
cx;wx;STRASBOURG;Musee Archeologique;Palais Rohan 2, Place du Château;67000;;NON;www.musees.strasbourg.eu;;
cx;wx;STRASBOURG;Musee des Arts Decoratifs;Palais Rohan 2, Place du Château;67000;;NON;www.musees-strasbourg.eu;;
cx;wx;STRASBOURG;Musee des Beaux-Arts;Palais Rohan 2, Place du Château;67000;;NON;www.musees.strasbourg.eu;24/12,25/12,11/11;
cx;wx;STRASBOURG;Musee Historique;3, Place de la Grande-Boucherie;67000;2016NON;NON;www.musees-strasbourg.eu;24/12,25/12;
cx;wx;STRASBOURG;Musee Zoologique de l'Universite Louis Pasteur et de la Ville de Strasbourg;29, Boulevard de la Victoire;67000;;NON;www.musees.strasbourg.eu;;
cx;wx;STRASBOURG;Musee Tomi Ungerer;Villa Greiner 2, avenue de la Marseillaise;67000;;NON;www.musees-strasbourg.eu;24/12,25/12,11/11;
cx;wx;STRASBOURG;Musee Alsacien;23-25, Quai Saint-Nicolas;67000;;NON;www.musees-strasbourg.eu;01/01,01/04,25/12;
cx;wx;STRASBOURG;Musee de l'Œuvre Notre-Dame;3, Place du Château;67000;;NON;www.musees-strasbourg.eu;;
cx;wx;STRASBOURG;Cabinet des Estampes et des Dessins;5, Place du Château;67000;;NON;www.musees-strasbourg.eu;;
cx;wx;STRASBOURG;Musee d'Art Moderne et Contemporain de Strasbourg;1 place Hans Jean Arp;67000;;NON;www.musees-strasbourg.eu;01/11-01/04;
cx;wx;WALDERSBACH;Musee J.F. Oberlin;25, Montee Oberlin;67130;;NON;www.musee-oberlin.com;;
cx;wx;WINGEN-SUR-MODER;Musee Lalique;40 rue du Hochberg;67290;;NON;www.musee-lalique.com;;
cx;wx;WISSEMBOURG;Musee Westercamp;3, rue du Musee;67160;2013OUI;OUI;www.musee-wissembourg.webmuseo.com ou www.ville-wissembourg.eu;01/11-01/04;
cx;wx;WOERTH;Musee de la Bataille du 6 Aout 1870;2, Rue du Moulin;67360;;NON;www.musee-woerth.webmuseo.com;;
cx;HAUT-RHIN;ALTKIRCH;Musee Sundgauvien d'Altkirch;1, Rue de l'HOtel de Ville;68130;;NON;;;
cx;HAUT-RHIN;BIESHEIM;Musee Gallo-Romain;Place de la Mairie;68600;;NON;www.ville-biesheim.fr/museegr.html;24/12,25/12,11/11;
cx;HAUT-RHIN;CERNAY;Musee de la Porte de Thann;1, Rue de Thann;68700;;NON;http://histoire-cernay.perso.sfr.fr ou www.musees-alsace.org;24/12,25/12,11/11;
cx;HAUT-RHIN;COLMAR;Musee d'Histoire Naturelle et d'Ethnographie de Colmar;11, Rue Turenne;68000;;NON;www.ac-strasbourg.fr/microsites/MHN_COLMAR;;
cx;HAUT-RHIN;COLMAR;Musee d'Unterlinden;1, rue Unterlinden;68000;;NON;www.musee-unterlinden.com;;
cx;HAUT-RHIN;COLMAR;Musee Bartholdi;30, Rue des Marchands;68000;;NON;www.musee-bartholdi.com;11/11,01/12-01/04;
cx;HAUT-RHIN;GUEBWILLER;Musee Theodore Deck et des Pays du Florival;1, Rue du Quatre Fevrier;68500;;NON;site de la ville ou www.tourisme68.asso.fr/musees/fr/mus12.1.html;;
cx;HAUT-RHIN;HUNINGE;Musee Historique et Militaire de Huningue;6, rue des Boulangers;68330;;NON;;;
cx;HAUT-RHIN;KAYSERSBERG;Musee d'Histoire Local;64, avenue du General de Gaulle;68240;;NON;www.ville-kaysersberg.fr;24/12,25/12;
cx;HAUT-RHIN;KIENTZHEIM;Musee du Vignoble et des Vins d'Alsace;Château de la Confrerie St-Etienne;68240;;NON;www.musee-du-vignoble-alsace.fr;01/11-01/04;
cx;HAUT-RHIN;MULHOUSE;Musee des Beaux-Arts;4, Place Guillaume-Tell;68100;;NON;http://www.musees-mulhouse.fr/musee-des-beaux-arts/collections.html;24/12,25/12;
cx;HAUT-RHIN;MULHOUSE;Musee Historique;4, Rue des Archives;68100;;NON;www.musees-mulhouse.fr/musee-historique/collections.html;;
cx;HAUT-RHIN;MULHOUSE;Musee du Sapeur Pompier;Association des Amis du Musee 4, Boulevard de la Marseillaise;68100;2017OUI;OUI;http://musee.spmulhouse.free.fr;24/12,25/12;
cx;HAUT-RHIN;MULHOUSE;Cite du Train;2, rue Alfred de Glehn;68200;;NON;www.culturespaces.com;01/01,01/04,25/12;
cx;HAUT-RHIN;MULHOUSE Cedex;Musee Mineralogique de la Societe Industrielle de Mulhouse;3, Avenue Alfred-Werner;68093;;OUI;;01/11-01/04;
cx;HAUT-RHIN;MULHOUSE Cedex;Musee EDF Electropolis;55, rue du Pâturage B.P. 52463;68057;;NON;www.edf.electropolis.mulhouse.museum;;
cx;HAUT-RHIN;MULHOUSE Cedex;Musee National de l'Automobile - Collection Schlumpf;192, Avenue de Colmar CS 91096;68051;;NON;www.collection-schlumpf.com;;
cx;HAUT-RHIN;MULHOUSE CEDEX;Musee de l'Impression sur Etoffes;14, rue Jean-Jacques Henner B.P. 1468;68072;;NON;www.musee-impression.com;01/01,01/04,25/12;
cx;HAUT-RHIN;NEUF-BRISACH;Musee Vauban;7, Place de la Porte de Belfort;68600;;NON;www.neuf-brisach.fr;24/12,25/12,11/11;
cx;HAUT-RHIN;OLTINGUE;Maison du Sundgau - Musee Paysan;10, rue Principale;68480;;NON;;24/12,25/12;
cx;HAUT-RHIN;RIQUEWIHR;Musee du Dolder;Rue du General de Gaulle;68340;;NON;Site des musees d'Alsace;24/12,25/12,11/11;
cx;HAUT-RHIN;RIXHEIM Cedex;Musee du Papier Peint;La Commanderie  28, rue Zuber B.P. 41;68171;;NON;www.museepapierpeint.org;;
cx;HAUT-RHIN;THANN;Musee des Amis de Thann;24, Rue Saint Thiebaut;68800;;NON;www.ville-thann.fr - http://www.genealogiethaznn.org;11/11,01/12-01/04;
cx;HAUT-RHIN;UNGERSHEIM;Ecomusee d'Alsace;B.P. 71;68190;;NON;www.ecomusee-alsace.com;;
AQUITAINE;DORDOGNE;BERGERAC;Musee d'Anthropologie du Tabac d'Interêt National;Maison Peyrarede Place du Feu;24100;;NON;http://www.bergerac.fr/EspCulture/sitetabac/index.htm;;
AQUITAINE;DORDOGNE;BOURDEILLES;Château de Bourdeilles;Bourdeilles;24310;;NON;Site des musees aquitains;;
AQUITAINE;DORDOGNE;BRANTOME;Musee Fernand Desmoulin;Boulevard Charlemagne;24310;;NON;Site des musees aquitains ou http://www.perigord-dronne-belle.fr;24/12,25/12;
AQUITAINE;DORDOGNE;CREYSSE;Musee-Aquarium;Site Bella-Riva;24100;;OUI;;11/11,01/12-01/04;
AQUITAINE;DORDOGNE;DOMME;Musee Paul Reclus;Place de la Halle;24250;;NON;;24/12,25/12,11/11;
AQUITAINE;DORDOGNE;LES EYZIES-DE-TAYAC;Musee National de la Prehistoire;B.P. 7;24620;;NON;www.musee-prehistoire-eyzies.fr;;
AQUITAINE;DORDOGNE;MONTIGNAC;Musee Eugene Le Roy et des Vieux Metiers;Place Bertran de Borne;24290;;OUI;;01/11-01/04;
AQUITAINE;DORDOGNE;MUSSIDAN;Musee des Arts et Traditions Populaires du Perigord;2, Rue Raoul Grassin;24400;;NON;www.museevoulgre.cjb.net;;
AQUITAINE;DORDOGNE;NONTRON;Musee Departemental de la Poupee et du Jouet;Avenue du General Leclerc;24300;;OUI;Site des musees aquitains;11/11,01/12-01/04;
AQUITAINE;DORDOGNE;PERIGUEUX;Musee Militaire - Souvenir du Perigord;32, Rue des Farges;24000;;NON;;11/11,01/12-01/04;
AQUITAINE;DORDOGNE;PERIGUEUX;Musee d'Art et d'Archeologie du Perigord (MAAP);22, Cours Tourny;24000;;NON;http://www.perigueux-maap.fr/;;
AQUITAINE;DORDOGNE;PERIGUEUX;Musee Gallo-Romain de Vesunna;Parc de Vesone 20, Rue du 26eme Regiment d'Infanterie;24000;;NON;www.vesunna.fr ou http://www.perigueux-vesunna.fr/;11/11,01/12-01/04;
AQUITAINE;DORDOGNE;SAINT-AVIT-SENIEUR;Musee du Site Medieval;;24440;;NON;;;
AQUITAINE;DORDOGNE;SARLAT-LA-CANEDA;Musee de Sarlat et du Perigord Noir;B.P. 163;24205;;OUI;Site des musees aquitains;24/12,25/12,11/11;
AQUITAINE;DORDOGNE;VILLEFRANCHE-DE-LONCHAT;Musee d'Art et Traditions Populaires;HOtel de ville Place de la liberte;24610;2016OUI;OUI;Site des musees aquitains;;
AQUITAINE;GIRONDE;BLASIMON;Musee Municipal de Blasimon;Mairie de Blasimon;33540;;OUI;;;
AQUITAINE;GIRONDE;BLAYE;Musee d'Art et d'Histoire du Pays Blayais;Citadelle de Blaye;33390;;OUI;Site des musees aquitains;;
AQUITAINE;GIRONDE;BORDEAUX;Musee Goupil;Conservatoire de l'Image Industrielle 20 Cours Pasteur;33000;;NON;Site de la ville;11/11,01/12-01/04;
AQUITAINE;GIRONDE;BORDEAUX;Centre National Jean Moulin;Direction des etablissements culturels 48, rue Vital Carles;33000;;NON;Site de la ville : www.bordeaux.fr;;
AQUITAINE;GIRONDE;BORDEAUX;Museum d'Histoire Naturelle de Bordeaux;5, Place Bardineau;33000;2016OUI;OUI;www.mairie-bordeaux.fr;;
AQUITAINE;GIRONDE;BORDEAUX;CAPC Musee d'Art Contemporain de Bordeaux;EntrepOt 7, Rue Ferrere;33000;;NON;www.capc-bordeaux.fr ou www.bordeaux.fr;24/12,25/12;
AQUITAINE;GIRONDE;BORDEAUX;Musee des Beaux-Arts;20, Cours D'Albret;33000;;NON;Site de la ville;01/11-01/04;
AQUITAINE;GIRONDE;BORDEAUX;Musee d'Aquitaine;20, Cours Pasteur;33000;;NON;Site de la ville : www.bordeaux.fr;01/01,01/04,25/12;
AQUITAINE;GIRONDE;BORDEAUX;Musee des Arts Decoratifs;HOtel de Lalande 39, Rue Bouffard;33000;;NON;Site de la ville -  www.mairie-bordeaux.fr;01/01,01/04,25/12;
AQUITAINE;GIRONDE;BOURG-SUR-GIRONDE;Musee de la Voiture a Cheval;3, Place de la Citadelle;33710;;NON;Site des musees d'aquitaine;11/11,01/12-01/04;
AQUITAINE;GIRONDE;LA REOLE;Musee Municipal;Esplanade Charles de Gaulle;33190;;OUI;;;
AQUITAINE;GIRONDE;LIBOURNE;Musee des Beaux-Arts et d'Archeologie;42, Place  Abel Surchamp;33500;;NON;www.musees-libourne.org;;
AQUITAINE;GIRONDE;LIBOURNE;Musee Historique ou du Vieux Libourne (Robin);;33500;;OUI;;;
AQUITAINE;GIRONDE;SAINT-EMILION;Musee d'Histoire et d'Archeologique;Logis Mallet;33330;;OUI;;;
AQUITAINE;GIRONDE;VILLANDRAUT;Musee Municipal;Maison Braneyre Impasse Dupeyron;33730;;OUI;;01/11-01/04;
AQUITAINE;LANDES;BISCARROSSE;Musee Historique de l'Hydravion;332, Avenue Louis Breguet;40600;;NON;www.hydravions-biscarrosse.com;24/12,25/12;
AQUITAINE;LANDES;DAX Cedex;Musee de Borda;Mairie de Dax Service du musee Borda 14, Rue Saint Pierre B.P. 50344;40107;;NON;http://www.dax.fr/musee-de-borda - Site des musees aquitains;;
AQUITAINE;LANDES;HASTINGUES;Musee Departemental de Prehistoire;Abbaye d'Arthous;40300;;NON;www.culture-commune.fr - www.arthous.landes.org/;;
AQUITAINE;LANDES;LUXEY;Atelier-Musee  (Ecomusee de la Grande Landes);101, Rue Jacques Desert;40043;;OUI;Site du parc - www.parc-landes-de-gascogne.fr;;
AQUITAINE;LANDES;MONT-DE-MARSAN;Musee Despiau-Wlerick;6, Place Marguerite de Navarre;40000;;NON;www.mont-de-marsan.org/decouvrir/decouv_muse.html ou Site des musees aquitains;01/11-01/04;
AQUITAINE;LANDES;MONTFORT-EN-CHALOSSE;Musee de la Chalosse;Domaine de Carcher 480, Chemin du Sala bp 24 B.P. 24;40380;;NON;www.museedelachalosse.fr;;
AQUITAINE;LANDES;MOUSTEY;Musee du Patrimoine Religieux et des Croyances Populaires;Eglise Notre-Dame;40410;;OUI;Site du parc - www.parc-landes-de-gascogne.fr;;
AQUITAINE;LANDES;SABRES;Ecomusee de la Grande Lande;Route de Soferino;40630;;NON;www.parc-landes-de-gascogne.fr;;
AQUITAINE;LANDES;SAINT-SEVER;Musee Municipal;Rue du General Lamarque;40500;;NON;http://www.saint-sever.fr/culture_musee.htm;01/01,01/04,25/12;
AQUITAINE;LANDES;SAMADET;Musee Departemental de la Faïence et des Arts de la table;2378, Route d'Hagetmau;40320;;NON;www.museesamadet.landes.org;;
AQUITAINE;LANDES;SANGUINET;Musee Municipal du Lac;112, Place de la Mairie;40460;;NON;www.ville-sanguinet.fr;01/01,01/04,25/12;
AQUITAINE;LOT ET GARONNE;AGEN Cedex 9;Musee des Beaux-Arts;Place du Dr Pierre Esquirol;47916;;NON;www.agen.fr/musee;;
AQUITAINE;LOT ET GARONNE;MARMANDE;Musee Municipal Albert Marzelles;15, Rue Abel Boye;47200;;NON;Site des musees aquitains et site de la ville;;
AQUITAINE;LOT ET GARONNE;MEZIN;Musee du Liege et du Bouchon;Rue du Puits Saint COme;47170;;NON;www.cg47.fr;;
AQUITAINE;LOT ET GARONNE;NERAC;Musee du Château Henri IV;Rue Henri IV;47600;;NON;Site des musees aquitains ou www.nerac.fr;;
AQUITAINE;LOT ET GARONNE;SAUVETERRE-LA-LEMANCE;Musee de Prehistoire Mesolithique Laurent Coulonges;Le Bourg;47500;;NON;www.sauveterre-prehistoire.fr ou Site des musees aquitains;24/12,25/12,11/11;
AQUITAINE;LOT ET GARONNE;VILLENEUVE-SUR-LOT;Musee Municipal (Moulin de Gajac);2, Rue du Jardins;47300;;NON;Site de la ville;01/01,01/04,25/12;
AQUITAINE;PYReNeES ATLANTIQUES;ARUDY;Musee Municipal;Rue de l'Eglise;64260;;NON;www.museearudy.com ou www.ot-arudy.fr;;
AQUITAINE;PYReNeES ATLANTIQUES;BAYONNE;Musee Bonnat-Helleu - Musee des Beaux-Arts de Bayonne;5, Rue Jacques-Laffitte;64100;;OUI;www.museebonnat.bayonne.fr;01/11-01/04;
AQUITAINE;PYReNeES ATLANTIQUES;BAYONNE;Museum d'Histoire Naturelle;Mairie de Bayonne Plaine d'Ansot;64100;;NON;www.museum.bayonne.fr ou www.ansot.bayonne.fr;;
AQUITAINE;PYReNeES ATLANTIQUES;BAYONNE;Musee Basque et de l'Histoire de Bayonne;37, Quai des Corsaires;64100;;NON;www.musee-basque.com;;
AQUITAINE;PYReNeES ATLANTIQUES;CAMBO-LES-BAINS;Musee Edmond Rostand;Villa Arnaga Route du Docteur Camino;64250;;NON;www.arnaga.com;;
AQUITAINE;PYReNeES ATLANTIQUES;GUETHARY;Musee Municipal de Guethary;Parc municipal Andre Narbaits  117, Avenue du General de Gaulle;64210;;NON;http://www.musee-de-guethary.fr/ OU Site des musees aquitains;;
AQUITAINE;PYReNeES ATLANTIQUES;PAU;Musee Bernadotte;8, Rue Tran;64000;;NON;site de la ville;01/11-01/04;
AQUITAINE;PYReNeES ATLANTIQUES;PAU;Musee Municipal des Beaux-Arts;Rue Mathieu Lalanne;64000;;NON;http://musee.ville-pau.fr;;
AQUITAINE;PYReNeES ATLANTIQUES;PAU;Musee Bearnais;Association Regionaliste de Pyrenees 7 avenue Henri Faisans;64000;;OUI;;24/12,25/12;
AQUITAINE;PYReNeES ATLANTIQUES;PAU;Musee National du Château;;64000;;NON;www.musee-chateau-pau.fr;24/12,25/12;
AUVERGNE;ALLIER;CERILLY;Musee Charles-Louis Philippe;5, Rue Charles-Louis Philippe;3350;;NON;http://site.voila.fr/Bourbonnais/charles/index.htm;24/12,25/12;
AUVERGNE;ALLIER;GANNAT;Musee Municipal de Gannat;Place Rantian;3800;;NON;http://www.bassin-gannat.com/;01/01,01/04,25/12;
AUVERGNE;ALLIER;IZEURE;Musee Rural de la Sologne Bourbonnaise;Michel LABONNE Secretaire des Amis du Museee 149, Route de Bourgogne;3400;;OUI;;24/12,25/12;
AUVERGNE;ALLIER;MONTLUCON Cedex;Musee des Musiques Populaires;BP 3249 (Château des Ducs de Bourbons);3106;;NON;www.musees-montlucon.com;24/12,25/12,11/11;
AUVERGNE;ALLIER;MOULINS;Centre National du Costume de Scene et de la Scenographie;Quartier Villars Route de montilly;3000;;NON;www.cncs.fr;24/12,25/12,11/11;
AUVERGNE;ALLIER;MOULINS Cedex;Musee Anne de Beaujeu;1, Avenue Victor Hugo B.P. 1669;3016;;NON;www.mab.allier.fr;24/12,25/12;
AUVERGNE;ALLIER;NERIS-LES-BAINS;Musee Rieckotter;HOtel de Ville Boulevard des Arene - B.P. 10;3310;;NON;site de la ville www.ville-neris-les-bains.fr;;
AUVERGNE;ALLIER;SOUVIGNY;Musee Municipal de Souvigny;Place Aristide Briand;3210;;NON;site de la ville www.ville-souvigny.com;11/11,01/12-01/04;
AUVERGNE;ALLIER;VICHY;Musee des Arts D'Afrique et D'Asie;11, Rue Mounin;3200;;NON;www.musee-aaa.com;24/12,25/12;
AUVERGNE;CANTAL;AURILLAC;Musee des Sciences;Château Saint Etienne;15000;;NON;www.aurillac.fr;01/01,01/04,25/12;
AUVERGNE;CANTAL;AURILLAC Cedex;Musee d'Art et d'Archeologie;Centre Culturel Pierre Mendes France 37, rue des Carmes;15012;;NON;www.ville-aurillac.fr;;
AUVERGNE;CANTAL;RUYNES-EN-MARGERIDE;Ecomusee de Margeride-Haute-Auvergne;La Tour Jardin de Saint-Martin;15320;;NON;http://www.saint-flour.fr/culture/musees/ecomusee-margeride.php;;
AUVERGNE;CANTAL;SAINT-FLOUR;Musee de la Haute Auvergne;Palais episcopal 1, Place d'Armes;15100;;NON;www.auvergne-centrefrance.com/geotouring/musees/detail/mus154.htm;01/11-01/04;
AUVERGNE;CANTAL;SAINT-FLOUR;Musee d'art et d'histoire Alfred Douët;Maison consulaire 17, Place d'Armes;15100;;NON;www.musee-douet.com;24/12,25/12,11/11;
AUVERGNE;HAUTE-LOIRE;CHILHAC;Musee de Paleontologie;Place de l'eglise;43380;;NON;http://www.museechilhac.fr;24/12,25/12;
AUVERGNE;HAUTE-LOIRE;LAVAUDIEU;Musee des Arts et Traditions Populaires de Haute Loire;;43100;;NON;Site des amis de Lavaudieu - www.abbayedelavaudieu.fr;24/12,25/12,11/11;
AUVERGNE;HAUTE-LOIRE;LE PUY-EN-VELAY;Musee Crozatier;Jardin Henri Vinay;43000;;OUI;www.mairie-le-puy-en-velay.fr;;
AUVERGNE;HAUTE-LOIRE;RETOURNAC;Musee des Manufactures de Dentelles;14, avenue de la Gare;43130;;NON;www.ville-retournac.fr/musee/francais/indexfr.htm;11/11,01/12-01/04;
AUVERGNE;HAUTE-LOIRE;SAINT ARCONS D'ALLIER;Musee de la Ferblanterie;;43300;;NON;;24/12,25/12;
AUVERGNE;PUY DE DOME;ARLANC;Musee de la Dentelle;53, Route Nationale;63220;;NON;www.arlanc.com/musee_dentelle.htm;24/12,25/12;
AUVERGNE;PUY DE DOME;CLERMONT-FERRAND;Musee d'Art Roger-Quillot;Quartier historique de Montferrand Place Louis Deteix;63100;;NON;http://museedart.clermont-ferrand.fr;24/12,25/12;
AUVERGNE;PUY DE DOME;CLERMONT-FERRAND;Musee d'Archeologie Bargoin;45, rue Ballainvilliers;63000;;NON;www.clermont-ferrand.fr/-Musee-Bargoin-.html;;
AUVERGNE;PUY DE DOME;CLERMONT-FERRAND;Museum d'Histoire Naturelle Henri-Lecoq;15, rue Bardoux;63000;;NON;www.museelecoq.clermont-ferrand.fr ou www.clermont-ferrand.fr/-Museum-Henri-Lecoq-.html;01/11-01/04;
AUVERGNE;PUY DE DOME;LEZOUX;Musee Departemental de la Ceramique Gallo-Romaine;39, Rue de la Republique B.P. 30;63190;;NON;"www.puydedome.fr rubrique ""decouvrir le Puy-de-DOme""";;
AUVERGNE;PUY DE DOME;MARSAC-EN-LIVRADOIS;Musee des Penitents Blancs;Place de l'Eglise;63940;;NON;www.livradois.com/marsac/penitent/index.htm;24/12,25/12,11/11;
AUVERGNE;PUY DE DOME;MENAT;Musee Paleontologique;Le Bourg;63560;;NON;;;
AUVERGNE;PUY DE DOME;MOZAC;Musee Lapidaire;Place de l'Abbaye;63200;;NON;www.riom-communaute.fr;;
AUVERGNE;PUY DE DOME;MUROL;Musee Municipal;Parc du Prelong;63790;;NON;www.musee-murol.net/Musee.htm;;
AUVERGNE;PUY DE DOME;RIOM;Musee Francisque Mandet;14, Rue de l'HOtel de Ville;63200;;NON;www.riom-communaute.fr;01/01,01/04,25/12;
AUVERGNE;PUY DE DOME;RIOM;Musee Regional d'Auvergne;10 bis, Rue Delile;63200;;NON;www.riom-communaute.fr;01/01,01/04,25/12;
AUVERGNE;PUY DE DOME;THIERS;Musee Municipal de la Coutellerie;58, Rue de la Coutellerie;63300;;NON;www.ville-thiers.fr/Musee-de-la-Coutellerie;;
AUVERGNE;PUY DE DOME;VOLVIC;Musee Municipal Marcel Sahut;2, rue des Ecoles;63530;;OUI;www.volvic-tourisme.com/HTML/sites/site_musee.htm;01/01,01/04,25/12;
BOURGOGNE;COTE D’OR;ALISE-SAINTE-REINE;Museoparc - Alesia;1, Route des Trois Ormeaux;21150;;OUI;www.alesia.com;;
BOURGOGNE;COTE D’OR;AUXONNE;Musee Bonaparte;Bibliotheque Municipale Passage Xavier Girault;21130;;OUI;Site des musees de la region ou site de la ville;;
BOURGOGNE;COTE D’OR;BEAUNE;Musee E.J Marey;HOtel de Ville;21200;;OUI;www.musees-bourgogne.org;;
BOURGOGNE;COTE D’OR;BEAUNE;Musee du Vin de Bourgogne;HOtel des Ducs Rue d'Enfer;21200;;NON;www.musees-bourgogne.org ou www.beaune.fr;;
BOURGOGNE;COTE D’OR;BEAUNE;Musee des Beaux-Arts;Porte Marie de Bourgogne 6, boulevard Perpreuil;21200;;NON;www.musees-bourgogne.org ou www.beaune.fr;;
BOURGOGNE;COTE D’OR;BUFFON;Musee de la Siderurgie Grande Forge;La Grande Forge;21500;;OUI;;24/12,25/12;
BOURGOGNE;COTE D’OR;CHATILLON-SUR-SEINE;Musee du Châtillonnais - Tresor de Vix;14, Rue de la Liberation;21400;;NON;www.musee-vix.fr;01/01,01/04,25/12;
BOURGOGNE;COTE D’OR;DIJON;Musee de la Vie Bourguignonne, Perrin de Puycousin;Monastere des Bernardines 15-17, rue Sainte-Anne;21000;;NON;www.musees-bourgogne.org;;
BOURGOGNE;COTE D’OR;DIJON;Musee d'Art Sacre;Monastere des Bernardines 15-17, rue Sainte-Anne;21000;;NON;Site des musees de Bourgogne;;
BOURGOGNE;COTE D’OR;DIJON;Musee Magnin;4, rue des Bons Enfants;21000;;NON;www.musee-magnin.fr;01/01,01/04,25/12;
BOURGOGNE;COTE D’OR;DIJON;Musee François Rude;8, Rue Vaillant;21000;;NON;;11/11,01/12-01/04;
BOURGOGNE;COTE D’OR;DIJON;Museum - Jardin des Sciences;Parc de l'Arquebuse 14, Rue Jehan de Marville;21000;;NON;www.dijon.fr;;
BOURGOGNE;COTE D’OR;DIJON Cedex;Musee des Beaux-Arts;Palais des Ducs et des Etats de Bourgogne B.P. 1510;21033;;NON;http://mba.dijon.fr ou www.ville-dijon.fr;;
BOURGOGNE;COTE D’OR;DIJON Cedex;Musee Archeologique;5, Rue du Docteur Maret B.P. 1510;21033;;NON;Site des musees de Bourgogne - www.musees-bourgogne.org;24/12,25/12;
BOURGOGNE;COTE D’OR;FIXIN;Musee Noisot;Clos Napoleon;21220;;NON;Site des musee de Bourgogne;;
BOURGOGNE;COTE D’OR;GEVREY-CHAMBERTIN - Reulle Vergy;Musee des Arts et Traditions des Hautes-COtes;1 PLACE DE LA FONTAINE;21220;;OUI;;;
BOURGOGNE;COTE D’OR;MONTBARD;Musee des Beaux-Arts;Chapelle des Ursulines Rue Piron;21500;;NON;http://www.montbard.com/;24/12,25/12,11/11;
BOURGOGNE;COTE D’OR;MONTBARD cedex;Musee Buffon;Anciennes Ecuries de Buffon B.P. 90;21506;;NON;http://www.montbard.com/ ou Site des musees de Bourgogne;24/12,25/12;
BOURGOGNE;COTE D’OR;NUITS-SAINT-GEORGES;Musee Municipal;12, Rue Camille Rodier;21700;;NON;Site des musees de Bourgogne;;
BOURGOGNE;COTE D’OR;SAULIEU;Musee Municipal François Pompon;3, Place du Docteur Roclore;21210;;NON;Site des musees de Bourgogne ou www.saulieu.fr;;
BOURGOGNE;COTE D’OR;SEMUR-EN-AUXOIS;Musee Municipal;3, Rue Jean-Jacques Collenot;21140;;NON;Site des musees de Bourgogne;24/12,25/12;
BOURGOGNE;NIEVRE;CHATEAU-CHINON;Musee du Costume;16-18, rue Saint Christophe;58120;;NON;www.cg58.fr/patrimoi/costu.htm;24/12,25/12,11/11;
BOURGOGNE;NIEVRE;CHATEAU-CHINON;Musee du Septennat;6, rue du Château;58120;;NON;www.cg58.fr;;
BOURGOGNE;NIEVRE;CLAMECY;Musee d'Art et d'Histoire Romain Rolland;Avenue de la Republique;58500;;NON;www.musees-bourgogne.org;;
BOURGOGNE;NIEVRE;COSNE-SUR-LOIRE;Musee de la Loire de Cosne sur Loire;Place de la Resistance;58200;;NON;www.mairie-cosnessurloire.fr/Services/MUSEEE/ACCUEIL.htm;;
BOURGOGNE;NIEVRE;LA CHARITE-SUR-LOIRE;Musee Municipal;33, Rue des Chapelains;58400;;OUI;Site de l'OTSI ou des musees de Bourgogne;;
BOURGOGNE;NIEVRE;LA MACHINE;Musee de la Mine;1, Avenue de la Republique;58260;;NON;www.tourisme.cc-loire-foret.fr ou www.cg58.fr et Site des musees de Bourgogne;;
BOURGOGNE;NIEVRE;NEVERS;Musee de la Faïence Frederic Blandin;16, rue Saint-Genest;58000;;OUI;Site;01/01,01/04,25/12;
BOURGOGNE;NIEVRE;NEVERS;Musee Archeologique du Nivernais (Porte du Croux);Societe Nivernaise des Lettres et Sciences et Arts Rue de la Porte du Croux;58000;;OUI;Conseil general;;
BOURGOGNE;NIEVRE;POUILLY-SUR-LOIRE;Musee Ernest Guedon;17, quai Jules-Pabiot;58150;;OUI;;24/12,25/12;
BOURGOGNE;NIEVRE;SAINT-AMAND-EN-PUISAYE;Musee du Gres de Puisaye;Château de Saint-Amand;58310;;NON;www.cg58.fr - Site musees de Bourgogne;01/01,01/04,25/12;
BOURGOGNE;NIEVRE;VARZY;Musee Auguste Grasset;Place de la Mairie;58210;;NON;www.cg58.fr ou www.musees-bourgogne.org;;
BOURGOGNE;SAONE ET LOIRE;AUTUN;Museum d'Histoire Naturelle Jacques de La Comble;14, Rue Saint-Antoine;71400;;NON;www.autun.com/tourisme/museum.php;;
BOURGOGNE;SAONE ET LOIRE;AUTUN;Musee Verger Tarin;Rue des Sous-Chantres;71400;;OUI;;24/12,25/12,11/11;
BOURGOGNE;SAONE ET LOIRE;AUTUN;Musee Rolin;5, rue des Bancs;71400;;NON;www.autun.com ou Site des musees de Bourgogne;24/12,25/12;
BOURGOGNE;SAONE ET LOIRE;AUTUN;Musee Lapidaire Saint-Nicolas;Rue Saint Nicolas;71400;;OUI;;;
BOURGOGNE;SAONE ET LOIRE;BLANZY;Musee de la Mine;34, rue du Bois Clair;71450;;NON;www.ecomusee-creusot-montceau.fr Site des musees de Bourgogne et de l'ecomusee;01/11-01/04;
BOURGOGNE;SAONE ET LOIRE;BOURBON-LANCY;Musee Saint-Nazaire;Rue St Nazaire;71140;;NON;Site des musees de Bourgogne ou www.bourbon-lancy.com/musees_fr_02_07_02.html;;
BOURGOGNE;SAONE ET LOIRE;CHALON-SUR-SAONE;Musee Nicephore Niepce;28, Quai des Messageries;71100;;NON;www.museeniepce.com;;
BOURGOGNE;SAONE ET LOIRE;CHALON-SUR-SAONE;Musee Denon;Place de l'hotel de ville;71100;;NON;site des musees de Bourgogne;;
BOURGOGNE;SAONE ET LOIRE;CHAROLLES;Musee du Prieure de Charolles;Rue du Prieure;71120;;NON;Site des musees de Bourgogne ou site de la ville - http://www.ville-charolles.fr/musee-du-prieure;;
BOURGOGNE;SAONE ET LOIRE;CHAROLLES;Musee Rene Davoine;32, rue Rene Davoine;71120;;OUI;www.institut-charolais.com (site de l'office du tourisme);24/12,25/12;
BOURGOGNE;SAONE ET LOIRE;CLUNY;Musee d'Art et d'Archeologie;Palais Jean de Bourbon Parc abbatial;71250;;NON;Site des musees de Bourgogne;11/11,01/12-01/04;
BOURGOGNE;SAONE ET LOIRE;LE CREUSOT Cedex;Musee de l'Homme et de l'Industrie - Ecomusee de la Communaute Le Creusot-Monceau-Les-Mines;Château de la Verrerie B.P. 53;71202;;NON;www.ecomusee-creusot-montceau.fr;01/11-01/04;
BOURGOGNE;SAONE ET LOIRE;LOUHANS;"L'Atelier d'un Journal"" de Louhans - Musee Municipal";29, Rue des Dodânes;71500;;NON;www.ecomusee-de-la-bresse.com ou site des musees de Bourgogne;01/11-01/04;
BOURGOGNE;SAONE ET LOIRE;MACON;Musee des Ursulines;5, rue des Ursulines;71000;;NON;http://www.macon.fr/Culture-sports-et-loisirs/Les-Musees-de-Macon;01/11-01/04;
BOURGOGNE;SAONE ET LOIRE;MACON;Musee Lamartine;41, Rue Sigorgne;71000;;NON;http://www.macon.fr/Culture-sports-et-loisirs/Les-Musees-de-Macon;;
BOURGOGNE;SAONE ET LOIRE;MARCIGNY;Musee de la Tour du Moulin;7-9, rue de la Tour;71110;;NON;www.marcigny.fr/musee-de-la-tour-du-moulin - http://tourdumoulin.blogspot.com;;
BOURGOGNE;SAONE ET LOIRE;PARAY-LE-MONIAL;Musee Eucharistique du Hieron;13, Rue de la Paix;71600;;NON;www.musee-hieron.fr;;
BOURGOGNE;SAONE ET LOIRE;PARAY-LE-MONIAL;Musee Municipal;Avenue Jean-Paul II;71600;;OUI;;;
BOURGOGNE;SAONE ET LOIRE;PIERRE-DE-BRESSE;Ecomusee de la Bresse Bourguignonne;Château departemental;71270;;NON;www.ecomusee-de-la-bresse.com;;
BOURGOGNE;SAONE ET LOIRE;ROMANECHE-THORINS;Musee Departemental du Compagnonnage;Le Bourg;71570;;NON;http://www.cg71.fr/musee_compagnonnage/ ou http://musee-compagnonnage.cg71.fr;24/12,25/12;
BOURGOGNE;SAONE ET LOIRE;ROMENAY;Musee du Terroir;Le Champ Bressan;71470;;NON;;01/01,01/04,25/12;
