NOMREG;NOMDEP;VILLE;NOM DU MUSEE;ADR;CP;ANNREOUV;FERME;SITWEB;FERMETURE ANNUELLE;PERIODE OUVERTURE;;;;;;;;;;
LANGUEDOC-ROUSSILLON;GARD;VILLENEUVE-LES-AVIGNON;Musee Pierre de Luxembourg;3, Rue de la Republique;30400;;NON;Site du conseil general;;
LANGUEDOC-ROUSSILLON;HERAULT;AGDE;Musee Agathois;5 rue de la Fraternite;34300;;NON;;24/12,25/12;
LANGUEDOC-ROUSSILLON;HERAULT;BEZIERS;Musee du Biterrois;Rampe du 96eme caserne Saint Jacques;34500;;NON;Site de la ville;;
LANGUEDOC-ROUSSILLON;HERAULT;BEZIERS;Museum d'Histoire Naturelle;15 Place Pierre Semard;34500;;NON;Site de la ville;01/01,01/04,25/12;
LANGUEDOC-ROUSSILLON;HERAULT;BEZIERS;Musee des Beaux-Arts de Beziers;Place de la Revolution;34500;;NON;www.ville-beziers.fr/culture/02.cfm;;
LANGUEDOC-ROUSSILLON;HERAULT;BOUZIGUES;Musee de l'Etang de Thau;Quai du Port de Pêche;34140;;NON;www.bouzigues.fr/musee/francais/bouzigues-musee.html;;
LANGUEDOC-ROUSSILLON;HERAULT;FRONTIGNAN-LA-PEYRADE;Musee Municipal;4 bis, Rue Lucien Salette;34110;;NON;site de la ville - www.ville-frontignan.fr;;
LANGUEDOC-ROUSSILLON;HERAULT;HEREPIAN;Musee de la Cloche et de la Sonnaille;Espace Campanaire Andre-Malraux;34600;;OUI;;24/12,25/12;
LANGUEDOC-ROUSSILLON;HERAULT;LATTES Cedex;Site Archeologique Lattara - Musee Henri Prades de Montpellier Agglomeration;390, Avenue de Perols;34970;;NON;http://museearcheo.montpellier-agglo.com;;
LANGUEDOC-ROUSSILLON;HERAULT;LE CAP D'AGDE;Musee de l'Ephebe;Mas de La Clape;34300;;NON;Site cree en decembre 2012;24/12,25/12;
LANGUEDOC-ROUSSILLON;HERAULT;LES MATELLES;Musee Intercommunal du Pic Saint-Loup;1, Rue du Musee;34270;;NON;www.cc-picsaintloup.fr;;
LANGUEDOC-ROUSSILLON;HERAULT;LODEVE;Musee Fleury;HOtel du Cardinal de Fleury Square Georges Auric;34700;;NON;www.museedelodeve.fr;01/01,01/04,25/12;
LANGUEDOC-ROUSSILLON;HERAULT;MINERVE;Musee Archeologique;Place du Monument aux Morts;34210;;NON;;11/11,01/12-01/04;
LANGUEDOC-ROUSSILLON;HERAULT;MONTPELLIER;Musee de l'HOtel d'Espeyran;6, bis rue Montpellieret;34000;;NON;www.montpellier-agglo.com;;
LANGUEDOC-ROUSSILLON;HERAULT;MONTPELLIER;Musee du Vieux Montpellier;HOtel de Varennes 2, Place Petrarque;34000;;NON;;;
LANGUEDOC-ROUSSILLON;HERAULT;MONTPELLIER;Musee Fabre;13, rue Montpellieret;34000;;NON;www.montpellier-agglo.com/museefabre;;
LANGUEDOC-ROUSSILLON;HERAULT;MONTPELLIER;Musee Languedocien;HOtel des Tresoriers de France 7, Rue Jacques-Cœur;34000;;NON;www.musee-languedocien.com;;
LANGUEDOC-ROUSSILLON;HERAULT;MONTPELLIER Cedex 5;Agropolis-Museum;951, Avenue Agropolis;34394;;OUI;www.museum.agropolis.fr;11/11,01/12-01/04;
LANGUEDOC-ROUSSILLON;HERAULT;MURVIEL-LES-MONTPELLIER;Musee Municipal;HOtel de ville Rue des Lavoirs;34570;;NON;www.ville-murviel-les-montpellier.fr;;
LANGUEDOC-ROUSSILLON;HERAULT;PEZENAS;Musee de Vulliod Saint-Germain;3, Rue Albert-Paul Allies;34120;;NON;Site de la ville;24/12,25/12,11/11;
LANGUEDOC-ROUSSILLON;HERAULT;SAINT-PONS-DE-THOMIERES;Musee de Prehistoire Regionale et du Megalithisme;8, Grand'Rue;34220;;NON;www.pays-saintponais.com;;
LANGUEDOC-ROUSSILLON;HERAULT;SETE;Musee Paul Valery;148, Rue François Desnoyer;34200;;NON;www.museepaulvalery-sete.fr;;
LANGUEDOC-ROUSSILLON;LOZERE;MENDE;Musee Ignon Fabre;3, Rue de l'Epine;48000;;OUI;;;
LANGUEDOC-ROUSSILLON;LOZERE;PONT DE MONTVERT;Ecomusee du Mont Lozere;Route de Finiels;48220;;NON;www.mescevennes.com/decouvertes/ecomusee_loz.htm;11/11,01/12-01/04;
LANGUEDOC-ROUSSILLON;PYRENEES ORIENTALES;CERET Cedex;Musee departemental d'Art Moderne;8, Bd Marechal Joffre B.P. 60413;66403;;NON;www.musee-ceret.com;;
LANGUEDOC-ROUSSILLON;PYRENEES ORIENTALES;COLLIOURE;Musee d'Art Moderne - Fonds Peske;Villa Pams Route de Port-Vendres;66190;;NON;www.collioure.net/musee.asp;01/01,01/04,25/12;
LANGUEDOC-ROUSSILLON;PYRENEES ORIENTALES;PERPIGNAN;Musee Archeologique de Ruscino;Château Roussillon;66000;;OUI;;24/12,25/12;
LANGUEDOC-ROUSSILLON;PYRENEES ORIENTALES;PERPIGNAN;Museum d'Histoire Naturelle;12, Place Fontaine Neuve;66000;;NON;www.mairie-perpignan.fr;24/12,25/12,11/11;
LANGUEDOC-ROUSSILLON;PYRENEES ORIENTALES;PERPIGNAN Cedex;Musee Joseph Puig;42, Avenue de Grande-Bretagne B.P. 931;66931;;NON;Site de la mairie - www.mairie-perpignan.fr;;
LANGUEDOC-ROUSSILLON;PYRENEES ORIENTALES;PERPIGNAN Cedex;Musee Hyacinthe Rigaud;16, rue de l'Ange B.P. 931;66931;;NON;Site de la mairie : www.mairie-perpignan.fr;24/12,25/12;
LANGUEDOC-ROUSSILLON;PYRENEES ORIENTALES;PERPIGNAN Cedex;Musee du Castillet Casa Pairal;Mairie de Perpignan B.P. 931;66931;;NON;Site de la mairie - www.mairie-perpignan.fr;24/12,25/12,11/11;
LANGUEDOC-ROUSSILLON;PYRENEES ORIENTALES;PORT-VENDRES;Musee d'Archeologie Sous-Marine;Mairie;66660;;OUI;;;
LANGUEDOC-ROUSSILLON;PYRENEES ORIENTALES;SAINTE-LEOCADIE;Musee de Cerdagne;Cal Mateu;66800;;OUI;www.museedecerdagne.com;01/11-01/04;
LANGUEDOC-ROUSSILLON;PYRENEES ORIENTALES;TAUTAVEL;Musee de Tautavel;Avenue Leon-Jean Gregory;66720;;NON;www.450000ans.com ou www.cerptautavel.com;11/11,01/12-01/04;
LIMOUSIN;CORREZE;BRIVE-LA-GAILLARDE;Musee Labenche d'Art et d'Histoire;26 bis, boulevard Jules Ferry;19100;;NON;www.musee-labenche.com ou www.brive.net;11/11,01/12-01/04;
LIMOUSIN;CORREZE;SARRAN;Musee du President Jacques Chirac;;19800;;NON;www.museepresidentjchirac.fr;;
LIMOUSIN;CORREZE;TULLE;Musee du CloItre de Tulle Andre Mazeyrie;Place Monseigneur Berteaud;19000;;NON;www.museecloitre-tulle.com ou www.ville-tulle.fr;24/12,25/12;
LIMOUSIN;CORREZE;TULLE;Musee de la Memoire et des Industries Tullistes;1, Rue du 9 juin 1944;19000;;NON;Site de la ville;;
LIMOUSIN;CORREZE;USSEL;Musee du Pays d'Ussel;B.P. 63;19208;;NON;http://www.ussel19.fr/culture-patrimoine/musee-du-pays-d-ussel.html;01/11-01/04;
LIMOUSIN;CREUSE;AUBUSSON;Musee Departemental de la Tapisserie;Avenue des Lissiers B.P. 89;23200;;NON;www.cite-tapisserie.fr;01/01,01/04,25/12;
LIMOUSIN;CREUSE;GUERET;Musee d'Art et d'Archeologie;HOtel de la Senatorerie 22, avenue de la Senatorerie;23000;;NON;www.ville-gueret.fr/culture/musee.php;;
LIMOUSIN;HAUTE VIENNE;CHATEAUPONSAC;Musee Rene Bauberot;1, place Saint-Thyrse;87290;;NON;www.museechateauponsac.com;11/11,01/12-01/04;
LIMOUSIN;HAUTE VIENNE;LIMOGES;Musee National Adrien Dubouche;8 bis, Place Winston Churchill;87000;;NON;www.musee-adriendubouche.fr;;
LIMOUSIN;HAUTE VIENNE;LIMOGES;Musee Municipal des Beaux-Arts de Limoges - Palais de l'Evêche;1, Place de l'Evêche;87000;;NON;www.museebal.fr;;
LIMOUSIN;HAUTE VIENNE;ROCHECHOUART;Musee Departemental d'Art Contemporain;Place du Château;87600;;NON;www.musee-rochechouart.com;;
LORRAINE;MEURTHE ET MOSELLE;DENEUVRE;Les Sources d'Hercule;1, place Jean-Marie Keyser;54120;;NON;;;
LORRAINE;MEURTHE ET MOSELLE;JARVILLE-LA-MALGRANGE;Musee de l'Histoire du Fer;1, Avenue du General de Gaulle B.P. 15;54140;;NON;www.grand-nancy.org;24/12,25/12;
LORRAINE;MEURTHE ET MOSELLE;LANEUVEVILLE-DEVANT-NANCY;Musee du Château de Montaigu;167, Rue Lucien Galtier;54410;;NON;http://www.nancy.fr/transver/coord.htm#muslor - Site du Grand Nancy;;
LORRAINE;MEURTHE ET MOSELLE;LONGWY;Musee Municipal des Emaux et Faïences;Port de France Rue de la Manutention;54400;;NON;http://http//www.mairie-longwy.fr;01/11-01/04;
LORRAINE;MEURTHE ET MOSELLE;LUNEVILLE;Musee du Château de Luneville;Place de la Deuxieme Division de Cavalerie;54300;;NON;www.chateauluneville.cg54.fr - http://www.chateaudeslumieres.com;;
LORRAINE;MEURTHE ET MOSELLE;NANCY;Musee de Zoologie - Aquarium Tropical;34, Rue Sainte-Catherine;54000;;NON;www.man.uhp-nancy.fr;;
LORRAINE;MEURTHE ET MOSELLE;NANCY;Musee Historique Lorrain;Palais Ducal 64, Grande Rue;54000;;NON;http://www.nancy.fr/transver/coord.htm#muslor - Site du Grand Nancy;;
LORRAINE;MEURTHE ET MOSELLE;NANCY;Musee de l'Ecole de Nancy;36-38, rue du Sergent Blandan;54000;;NON;www.ecole-de-nancy.com;24/12,25/12;
LORRAINE;MEURTHE ET MOSELLE;NANCY;Musee des Beaux-Arts de Nancy;3, Place Stanislas B.P. 218;54004;;NON;www.mairie-nancy.fr;;
LORRAINE;MEURTHE ET MOSELLE;PONT-A-MOUSSON;"Musee ""au Fil du Papier""";HOtel de la Monnaie 13, Rue Magot de Rogeville;54700;;NON;Site de la ville;;
LORRAINE;MEURTHE ET MOSELLE;TOUL;Musee d'Art et d'Histoire de Toul;25, Rue Gouvion Saint-Cyr;54200;;NON;;01/01,01/04,25/12;
LORRAINE;MEUSE;BAR-LE-DUC;Musee Barrois;Esplanade du Château;55000;;NON;site de la ville - http://www.barleduc.fr;11/11,01/12-01/04;
LORRAINE;MEUSE;COMMERCY;Musee de la Ceramique et de l'Ivoire;7, Avenue Carcano;55200;;NON;;01/01,01/04,25/12;
LORRAINE;MEUSE;MONTMEDY;Musee Jules Bastien-Lepage - Musee de la Fortification;La Citadelle B.P. 28;55600;;NON;www.tourisme-montmedy.fr;;
LORRAINE;MEUSE;SAINT-MIHIEL;Musee d'Art Sacre de la Meuse;Rue du Palais de Justice;55300;;NON;http://otsisaintmihiel.e-monsite.com;11/11,01/12-01/04;
LORRAINE;MEUSE;SAMPIGNY;Musee Departemental Raymond Poincare;Clos Raymond Poincare;55300;;NON;http://www.cg55.fr;24/12,25/12;
LORRAINE;MEUSE;STENAY;Musee de la Biere et du Pays de Stenay;Rue de la Citadelle;55700;;NON;www.musee-de-la-biere.com;11/11,01/12-01/04;
LORRAINE;MEUSE;VARENNES-EN-ARGONNE;Musee d'Argonne;2, Rue Louis XVI;55270;;NON;site de la conservation : www.cg55.fr;;
LORRAINE;MEUSE;VAUCOULEURS;Musee Jeanne d'Arc;HOtel de Ville;55140;;NON;;;
LORRAINE;MEUSE;VERDUN;Musee de la Princerie;16, Rue de la Belle Vierge;55100;;NON;www.ville-verdun.fr;;
LORRAINE;MOSELLE;GRAVELOTTE;Musee Departemental de la Guerre de 70;Rue de Metz;57130;2016OUI;OUI;;24/12,25/12;
LORRAINE;MOSELLE;MARSAL;Musee Departemental du Sel;Porte de France;57630;;NON;Site du conseil general - www.cg57.fr;01/11-01/04;
LORRAINE;MOSELLE;MEISENTHAL;Maison du Verre et du Cristal;Place Robert Schumann;57960;;NON;http://www.musee-verre.webmuseo.com/;01/11-01/04;
LORRAINE;MOSELLE;METZ;Musees de la Cour d'Or;2, Rue du Haut Poirier;57000;;NON;musees.metzmetropole.fr;;
LORRAINE;MOSELLE;METZ Cedex 1;Centre Pompidou de Metz;1, Parvis des Droits-de-l'Homme CS 90490;57020;;NON;www.centrepompidou-metz.fr;11/11,01/12-01/04;
LORRAINE;MOSELLE;NEUFCHEF;Musee des Mines de fer de Lorraine;Lieu dit Hameviller;57700;;NON;www.musee.desminesdefer-lorraine.com;01/01,01/04,25/12;
LORRAINE;MOSELLE;PETITE-ROSSELLE;Musee de la Mine - Carreau Wendel;Parc Explor Wendel;57540;;NON;www.la-mine.fr;;
LORRAINE;MOSELLE;PHALSBOURG;Musee Militaire et Erckmann-Chatrian;HOtel de Ville Place d’Armes;57370;;NON;www.phalsbourg.fr/La_culture__les_loisirs/Le_Musee;01/01,01/04,25/12;
LORRAINE;MOSELLE;SARREBOURG;Musee du Pays de Sarrebourg;Rue de la Paix;57400;;NON;www.musee-du-pays-de-sarrebourg.com;;
LORRAINE;MOSELLE;SARREGUEMINES;Jardin d'Hiver, Musee de La Faïence;15-17, Rue Poincare;57200;;NON;www.sarreguemines-museum.com;01/11-01/04;
LORRAINE;MOSELLE;SARREGUEMINES;Moulin de la Blies - Musee des Techniques Faïencieres;125, Avenue de la Blies;57200;;NON;www.sarreguemines-museum.com;;
LORRAINE;MOSELLE;THIONVILLE Cedex;La Tour aux Puces - Musee du Pays Thionvillois;Cour du Château B.P. 30352;57125;;NON;www.tourauxpuces.com;24/12,25/12,11/11;
LORRAINE;MOSELLE;VIC-SUR-SEILLE;Musee Departemental Georges de la Tour;HOtel de la Monnaie Rue Vignon;57630;;NON;www.cg57.fr/culture/1-8-delatour.asp;;
LORRAINE;VOSGES;EPINAL;Musee de l'Image;42 quai de Dogneville;88000;;NON;www.museedelimage.fr;24/12,25/12,11/11;
LORRAINE;VOSGES;EPINAL Cedex;Musee Departemental d'Art Ancien et Contemporain;1, Place Lagarde B.P. 436;88011;;NON;Site du conseil general - www.vosges.fr;;
LORRAINE;VOSGES;MIRECOURT CEDEX;Musee de la Lutherie;B.P. 189;88507;;NON;www.musee-lutherie-mirecourt.fr;;
LORRAINE;VOSGES;PLOMBIERES-LES-BAINS;Musee Louis Français;30, Avenue Louis Français;88370;;NON;site de la ville;01/11-01/04;
LORRAINE;VOSGES;REMIREMONT;Musee Charles de Bruyeres;70, Rue Charles de Gaulle;88200;;NON;www.remiremont.fr/culture/musees.php;;
LORRAINE;VOSGES;REMIREMONT;Musee Charles Friry;12, Rue du General Humbert;88200;;NON;www.remiremont.fr/culture/musees.php;24/12,25/12;
LORRAINE;VOSGES;SAINT-DIE-DES-VOSGES;Musee Pierre Noël - Musee de la Vie dans les Hautes-Vosges;11, rue Saint-Charles;88100;;NON;Site de la ville - www.ville-saintdie.fr;;
MARTINIQUE;MARTINIQUE;FORT-DE-FRANCE;Musee Departemental d'Archeologie Precolombienne et de Prehistoire de la Martinique;9, rue de la Liberte;97200;;NON;www.cg972.fr/mdap;01/01,01/04,25/12;
MARTINIQUE;MARTINIQUE;FORT-DE-FRANCE - MARTINIQUE-;Musee Regional d'Histoire et d'Ethnologie;10, Boulevard du General de Gaulle;97200;;NON;http://www.cr-martinique.fr/francais/institution/serv-region/musees/histoire_ethno.htm;;
MARTINIQUE;MARTINIQUE;FORT-DE-FRANCE TERRE-SAINVILLE Cedex;Museum d'Histoire Naturelle;B.P. 4030;97254;;OUI;;;
MARTINIQUE;MARTINIQUE;LES TROIS ILETS;Musee de La Canne;Quartier Vatable;97229;;NON;http://www.zananas-martinique.com/martinique-patrimoine/maison-de-la-canne.html;;
MARTINIQUE;MARTINIQUE;RIVIERE-PILOTE;Ecomusee de la Martinique;Anse Figuier;97211;;NON;/www.cr-martinique.fr/francais/institution/serv-region/musees/ecomusee.htm;01/01,01/04,25/12;
MARTINIQUE;MARTINIQUE;SAINT-PIERRE;Musee Volcanologique Franck Arnold Perret;Rue Victor Hugo;97250;;NON;http://www.saintpierre-martinique.fr;;
MIDI-PYRENEES;ARIEGE;FOIX;Musee Departemental de l'Ariege;Rue du Rocher;9000;;NON;www.sesta.fr ou www.ariege.com/chateaufoix/index.html;01/01,01/04,25/12;
MIDI-PYRENEES;ARIEGE;LAVELANET;Musee du Textile et du Peigne en Corne;65, Rue Jean Jaures;9300;;NON;www.paysdolmes.org - www.geocities.com/amtpc2000;01/11-01/04;
MIDI-PYRENEES;ARIEGE;LE MAS D'AZIL;Musee de la Prehistoire;Place de l'Eglise;9290;;NON;www.grotte-masdazil.com;;
MIDI-PYRENEES;ARIEGE;MONTGAILHARD;Musee de la Forge;Route de Paris;9330;;NON;www.sesta.fr;;
MIDI-PYRENEES;ARIEGE;MONTSEGUR;Musee d'Archeologie;32, Village;9300;;NON;Site de la ville : www.citaenet.com/montsegur;;
MIDI-PYRENEES;ARIEGE;SAINT-LIZIER;Musee du Palais des Evêques;Route de Montjoie;9190;;NON;Site du Service d'exploitation des sites touristiques de l'Ariege - www.sesta.fr ou www.grands-sites-ariege.fr;24/12,25/12,11/11;
MIDI-PYRENEES;AVEYRON;DECAZEVILLE;Musee Regional de Geologie Pierre Vetter;Avenue Paul Ramadier;12300;;NON;www.decazeville.fr ou www.musees-midi-pyrenees.fr;11/11,01/12-01/04;
MIDI-PYRENEES;AVEYRON;ESPALION;Musee Joseph Vaylet;Ancienne eglise St. Jean Baptiste 35, rue Droite;12500;;NON;www.tourisme-espalion.fr - http://www.museeduscaphandre.com;;
MIDI-PYRENEES;AVEYRON;ESPALION;Musee des Mœurs et Coutumes, Musee du Rouergue;Place Frontin;12500;;NON;www.aveyron-culture.com;;
MIDI-PYRENEES;AVEYRON;MILLAU;Musee Municipal de Millau;HOtel de Pegayolles Place du Marechal Foch;12100;;NON;www.millauculture.fr ou www.ot-millau.fr;11/11,01/12-01/04;
MIDI-PYRENEES;AVEYRON;RODEZ;Musee Fenaille;14, Place Eugene Raynaldy;12000;;NON;www.musee-fenaille.com ou www.grandrodez.com;;
MIDI-PYRENEES;AVEYRON;RODEZ;Musee des Beaux-Arts Denys Puech;Place Georges Clemenceau;12000;;NON;Site de la mairie;24/12,25/12;
MIDI-PYRENEES;AVEYRON;RODEZ Cedex;Musee Soulages;Communaute d'agglomeration du Grand Rodez 1, Place Adrien-Rozier - B.P. 531;12005;2018OUI;OUI;www.grand-rodez.com ou http://musee-soulages.grand-rodez.com/;11/11,01/12-01/04;
MIDI-PYRENEES;AVEYRON;ROQUEFORT-SUR-SOULZON;Musee Municipal d'archeologie;Rue Saint-Pierre;12250;;OUI;;01/11-01/04;
MIDI-PYRENEES;AVEYRON;SALLES-LA-SOURCE;Musee des Arts et Metiers;;12330;;NON;www.cg12.fr;;
MIDI-PYRENEES;AVEYRON;SALMIECH;Musee du Charroi Rural et de l'Artisanat Traditionnel;Ancienne Eglise Saint-Firmin;12120;;NON;www.aveyron-culture.com;24/12,25/12,11/11;
MIDI-PYRENEES;AVEYRON;VILLEFRANCHE-DE-ROUERGUE;Musee Municipal Urbain Cabrol;Place de la Fontaine;12200;;NON;www.villefranchederouergue.fr;11/11,01/12-01/04;
MIDI-PYRENEES;GERS;AUCH;Musee des Jacobins;4, Place Louis Blanc;32000;;NON;www.musee-jacobins.auch.fr www.auch-tourisme.com ou site de la mairie;;
MIDI-PYRENEES;GERS;CONDOM;Musee de l'Armagnac;2, Rue Jules Ferry;32100;;NON;site du departement : www.gers-gascogne.com;;
MIDI-PYRENEES;GERS;EAUZE;Musee Archeologique;Place de la Republique;32180;;NON;site du departement : www.gers-gascogne.com ou site de la mairie;24/12,25/12,11/11;
MIDI-PYRENEES;GERS;L'ISLE JOURDAIN;Musee Campanaire;Place de l'HOtel de ville;32600;;NON;site du departement : www.gers-gascogne.com;;
MIDI-PYRENEES;GERS;LECTOURE;Musee d'Archeologie;Place du General de Gaulle HOtel de Ville;32700;;NON;site du departement : www.gers-gascogne.com;;
MIDI-PYRENEES;GERS;MARCIAC;Musee Joseph Abeilhe;Mairie de Marciac 19, Place de l'HOtel de Ville;32230;;NON;Site de la region : www.musees-midi-pyrenees.fr;;
MIDI-PYRENEES;GERS;MIRANDE;Musee des Beaux-Arts et des Arts Decoratifs;13, rue de l'Evêche;32300;;NON;site du departement : www.gers-gascogne.com;;
MIDI-PYRENEES;HAUTE-GARONNE;AURIGNAC;Musee de Prehistoire;;31420;2016OUI;OUI;www.aurignacien.com;24/12,25/12;
MIDI-PYRENEES;HAUTE-GARONNE;BAGNERES-DE-LUCHON;Musee du Pays de Luchon;18, Allee d'Etigny;31110;;NON;www.luchon.com ou www.mairies-luchon.fr -www.musees-midi-pyrenees.fr;;
MIDI-PYRENEES;HAUTE-GARONNE;MARTRES-TOLOSANE;Musee Municipal;Place Henri Dulion;31220;;NON;www.tourisme-martres-tolosane.fr;24/12,25/12;
MIDI-PYRENEES;HAUTE-GARONNE;SAINT-BERTRAND-DE-COMMINGES;Musee Archeologique Departemental;Bâtiment de l'Ancienne Gendarmerie;31510;;OUI;http://www.musees-midi-pyrenees.fr/musees/musee-archeologique-departemental;01/11-01/04;
MIDI-PYRENEES;HAUTE-GARONNE;SAINT-GAUDENS;Musee Municipal d'Art et d'Histoire;6, place de Mas Saint Pierre;31800;;OUI;www.mairiestgaudens.fr;;
MIDI-PYRENEES;HAUTE-GARONNE;TOULOUSE;Musee Paul Dupuy;13, Rue de la Pleau;31000;;NON;;;
MIDI-PYRENEES;HAUTE-GARONNE;TOULOUSE;Musee Georges Labit;17, rue du Japon;31400;;NON;;24/12,25/12;
MIDI-PYRENEES;HAUTE-GARONNE;TOULOUSE;Musee du Vieux Toulouse;HOtel Dumay 7, Rue du May;31000;;NON;En projet;;
MIDI-PYRENEES;HAUTE-GARONNE;TOULOUSE;Musee des Transports et des Communications;93, avenue Jules Julien;31400;;OUI;http://asptuit.free.fr;11/11,01/12-01/04;
MIDI-PYRENEES;HAUTE-GARONNE;TOULOUSE;Museum d'Histoire Naturelle;35, allees Jules Guesde;31000;;NON;www.museum.toulouse.fr;01/01,01/04,25/12;
MIDI-PYRENEES;HAUTE-GARONNE;TOULOUSE;Musee Saint-Raymond;Place Saint Sernin;31000;;NON;www.SaintRaymond.toulouse.fr;24/12,25/12;
MIDI-PYRENEES;HAUTE-GARONNE;TOULOUSE;Musee des Augustins;21, rue de Metz;31000;;NON;www.augustins.org;01/01,01/04,25/12;
MIDI-PYRENEES;HAUTE-GARONNE;TOULOUSE;Les Abattoirs, Musee d'Art Moderne et Contemporain;76, allees Charles-de-Fitte;31300;;NON;www.lesabattoirs.org;;
MIDI-PYRENEES;HAUTES-PYRENEES;BAGNERES-DE-BIGORRE;Musee Bigourdan du Vieux Moulin;Rue Hount-Blanque;65200;;OUI;;01/01,01/04,25/12;
MIDI-PYRENEES;HAUTES-PYRENEES;BAGNERES-DE-BIGORRE;Musee Salies;Place des Thermes;65200;;NON;;;
MIDI-PYRENEES;HAUTES-PYRENEES;BAGNERES-DE-BIGORRE;Museum d'Histoire Naturelle;7, Place des Thermes de Salut;65200;;NON;;01/11-01/04;
MIDI-PYRENEES;HAUTES-PYRENEES;LOURDES;Musee Pyreneen;Château fort;65100;;NON;www.chateaufort-lourdes.fr ou site de la ville - http://www.lourdes-visite.com/;11/11,01/12-01/04;
MIDI-PYRENEES;HAUTES-PYRENEES;LUZ-SAINT-SAUVEUR;Musee Municipal;Presbytere;65120;;NON;;;
MIDI-PYRENEES;HAUTES-PYRENEES;MAUVEZIN;Musee-château Gaston Phebus;Château-Fort de Mauvezin;65130;;NON;www.chateaudemauvezin.com;;
MIDI-PYRENEES;HAUTES-PYRENEES;TARBES;Musee Massey;Jardin Massey;65000;;NON;http://www.tarbes.fr/gp/Le-musee-Massey/107/0;;
MIDI-PYRENEES;LOT;CABRERETS;Musee de Prehistoire de Cabrerets;Centre de Prehistoire du Pech Merle Mairie;46330;;NON;www.pechmerle.com;;
MIDI-PYRENEES;LOT;CAHORS;Musee Henri Martin;792, Rue Emile Zola;46000;;NON;www.mairie-cahors.fr/musee;;
MIDI-PYRENEES;LOT;FIGEAC;Musee Champollion - Les Ecriture du Monde;4, Rue des Freres Champollion;46100;;NON;www.musee-champollion.fr et site de la ville;01/01,01/04,25/12;
MIDI-PYRENEES;LOT;FIGEAC Cedex;Musee d'Histoire de Figeac;HOtel de la Monnaie Place Vival - BP. 10060;46102;;NON;www.tourisme-figeac.com;;
MIDI-PYRENEES;LOT;LABASTIDE MURAT;Musee Murat;Place de Tolentino;46240;;NON;site de l'association des amis du musee;;
MIDI-PYRENEES;LOT;LUZECH;"Musee Archeologique ""Armand-Vire""";Rue de la Ville;46140;;NON;http://www.ville-luzech.fr/musee-archeologique-armand-vire-luzech;;
MIDI-PYRENEES;LOT;MARTEL;Musee Gallo-Romain d'Uxellodunum;Palais de la Raymondie Place des Consuls;46600;;NON;;;
MIDI-PYRENEES;LOT;ROCAMADOUR;Musee d'Art Sacre;Parvis des Sanctuaires;46500;;OUI;;;
MIDI-PYRENEES;LOT;SAULIAC-SUR-CELE;Musee Departemental de Cuzals;;46330;;NON;www.museeduquercy.com;01/01,01/04,25/12;
MIDI-PYRENEES;LOT;SOUILLAC;Musee de l'Automate;Place de l'Abbaye;46200;;NON;www.musee-automate.fr;;
MIDI-PYRENEES;LOT;VAYRAC;Musee Municipal;Mairie;46110;;NON;http://www.vayrac.fr/uxellodunum.php?lg=fr;;
MIDI-PYRENEES;TARN;ALBI Cedex;Musee Toulouse Lautrec;Palais de la Berbie B.P. 100;81003;;NON;www.musee-toulouse-lautrec.com;01/11-01/04;
MIDI-PYRENEES;TARN;ANDILLAC;Musee Eugenie et Maurice Guerin;Château de Cayla;81140;;NON;http://musee-cayla.tarn.fr ou www.litterature-lieux.com;24/12,25/12;
MIDI-PYRENEES;TARN;CASTRES;Musee Jean Jaures;2, Place Pelisson;81100;;NON;www.ville-castres.fr ou www.musees-midi-pyrenees.fr/musees/centre-national-et-musee-jean-jaures/;;
MIDI-PYRENEES;TARN;CASTRES Cedex;Musee Goya;HOtel de Ville B.P. 10406;81108;;NON;www.ville-castres.fr;01/01,01/04,25/12;
MIDI-PYRENEES;TARN;CORDES-SUR-CIEL;Musee Charles Portal - Histoire et Patrimoine;Porte des Ormeaux 1, Rue Saint-Michel;81170;;OUI;http://savieuxcordes.canalblog.com ou http://musee-charles-portal.asso-web.com;;
MIDI-PYRENEES;TARN;FERRIERES;Musee du protestantisme en Haut-Languedoc;"""La Ramade""";81260;;NON;www.mpehl.org et www.musees-midi-pyrenees.fr;;
MIDI-PYRENEES;TARN;GAILLAC;Musee des Beaux-Arts;Avenue Dom-Vayssette;81600;;NON;Site de la ville www.ville-gaillac.fr;;
MIDI-PYRENEES;TARN;GAILLAC;Musee de l'Abbaye Saint-Michel;Place Saint-Michel;81600;;NON;site de la ville;24/12,25/12,11/11;
MIDI-PYRENEES;TARN;GAILLAC;Museum d'histoire naturelle Philadelphe Thomas;Place Philadelphe Thomas;81600;;NON;Site de la ville :  www.ville-gaillac.fr;11/11,01/12-01/04;
MIDI-PYRENEES;TARN;LA-BASTIDE-ROUAIROUX;Musee Departemental du Textile;Rue de la Rive;81270;;NON;http://musee-textile.tarn.fr;;
MIDI-PYRENEES;TARN;LAVAUR Cedex;Musee du Pays Vaurais;1, rue Jouxaygues;81500;;OUI;www.musees-midi-pyrenees.fr/musees/musee-du-pays-vaurais;01/11-01/04;
MIDI-PYRENEES;TARN;LISLE-SUR-TARN;Musee Raymond Lafage;10, Rue Victor Mazies;81310;;NON;www.ville-lisle-sur-tarn.fr - http://musee.lislesurtarn.over-blog.fr/;24/12,25/12,11/11;
MIDI-PYRENEES;TARN;RABASTENS;Musee du Pays Rabastinois;Mairie de Rabastens 2, Rue Amedee Clausade;81800;;NON;Site de la region : www.musees-midi-pyrenees.fr/musees/musee-du-pays-rabastinois;11/11,01/12-01/04;
MIDI-PYRENEES;TARN-ET-GARONNE;AUVILLAR;Musee du Vieil Auvillar;Mairie Place de la Halle;82340;;NON;www.auvillar.com;11/11,01/12-01/04;
MIDI-PYRENEES;TARN-ET-GARONNE;GRISOLLES;Musee Theodore Calbet;15, Rue Jean de Comere;82170;;NON;www.museecalbet.com;;
MIDI-PYRENEES;TARN-ET-GARONNE;MOISSAC;Musee des arts et traditions populaires;4, Rue de l'Abbaye;82200;;NON;;;
MIDI-PYRENEES;TARN-ET-GARONNE;MONTAUBAN;Musee d'Histoire Naturelle Victor Brun;2, Place Antoine Bourdelle;82000;;NON;http://www.montauban.com/;;
MIDI-PYRENEES;TARN-ET-GARONNE;MONTAUBAN Cedex;Musee Ingres;BP 752;82013;;NON;www.montauban.com;;
MIDI-PYRENEES;TARN-ET-GARONNE;SAINT-ANTONIN-NOBLE-VAL;Musee de Prehistoire;HOtel de Ville Place de la Mairie;82140;;NON;Site de la ville : www.saint-antonin-noble-val.com;;
NORD-PAS-DE-CALAIS;NORD;ANZIN;Musee Theophile Jouglet;215, Avenue Anatole-France;59410;;OUI;site de la ville ou www.mediatheque-anzin.fr;11/11,01/12-01/04;
NORD-PAS-DE-CALAIS;NORD;AVESNES-SUR-HELPE;Musee d'Histoire et d'Archeologie;BP 90;59440;;OUI;http://www.annuaire-mairie.fr/musee-de-la-societe-archeologique-d-avesnes-sur-helpe.html#musee;;
NORD-PAS-DE-CALAIS;NORD;BAILLEUL;Musee BenoIt de Puydt;24, Rue du Musee;59270;;NON;;01/01,01/04,25/12;
NORD-PAS-DE-CALAIS;NORD;BAVAY;Forum Antique de Bavay, Musee Archeologique du Departement du Nord;Allee Chanoine Henri Bievelet;59570;;NON;Site du conseil general : www.cg59.fr;;
NORD-PAS-DE-CALAIS;NORD;BERGUES;Musee du Mont-de-Piete;1, Rue du Mont-de-Piete;59380;;NON;www.musee-bergues.fr;01/11-01/04;
NORD-PAS-DE-CALAIS;NORD;BOUCHAIN;Musee de l'Ostrevant;192, rue Edouard Lalo;59111;;NON;http://museedostrevant.canalblog.com/;;
NORD-PAS-DE-CALAIS;NORD;CAMBRAI;Musee Municipal de Cambrai;15, Rue de l'Epee;59400;;NON;www.villedecambrai.com/culture/musee.html;;
NORD-PAS-DE-CALAIS;NORD;CAMBRAI Cedex;Musee Diocesain d'Art Sacre;Service de la conservation du patrimoine culturel 11, Rue du Grand Seminaire - B.P. 149;59403;;OUI;www.liturgiecatholique.fr/Musee-diocesain-d-Art-Sacre-du.html ou http://archives.cathocambrai.com/;;
NORD-PAS-DE-CALAIS;NORD;CASSEL;Musee Departemental de Flandre;26 Grand Place  B.P. 38;59670;;NON;http://museedeflandre.lenord.fr/fr/Accueil.aspx;11/11,01/12-01/04;
NORD-PAS-DE-CALAIS;NORD;DENAIN;Musee d'Archeologie et d'Histoire Locale;9, Place Wilson;59220;;NON;Site de la ville - www.ville-denain.fr;;
NORD-PAS-DE-CALAIS;NORD;DOUAI;Musee de la Chartreuse;130, Rue des Chartreux;59500;;NON;www.museedelachartreuse.fr/;;
NORD-PAS-DE-CALAIS;NORD;DUNKERQUE;Musee Portuaire;EntrepOt des Tabacs 9, Quai de la Citadelle;59140;;NON;www.museeportuaire.fr;;
NORD-PAS-DE-CALAIS;NORD;DUNKERQUE;Lieu d'Art et Action Contemporaine de Dunkerque - LAAC;Jardin des Sculptures Avenue de Bains;59140;;NON;http://www.museesdunkerque.wb.st;;
NORD-PAS-DE-CALAIS;NORD;DUNKERQUE CEDEX;Musee des Beaux-Arts;Place du General de Gaulle B.P. 4212;59378;;NON;http://www.musenor.com/gm/dunker1.htm;11/11,01/12-01/04;
NORD-PAS-DE-CALAIS;NORD;ESCAUDAIN;Musee Municipal d'Escaudain;Rue Paul Bert;59124;;NON;http//clec.free.fr;24/12,25/12,11/11;
NORD-PAS-DE-CALAIS;NORD;FOURMIES CEDEX;Ecomusee de la Region;Place Maria Blondeau B.P. 65;59612;;NON;www.ecomusee-avesnois.fr;;
NORD-PAS-DE-CALAIS;NORD;GRAVELINES;Musee du Dessin et de l'Estampe Originale;Château Arsenal Place Charles Valentin;59820;;NON;www.ville-gravelines.fr;11/11,01/12-01/04;
