NOMREG;NOMDEP;VILLE;NOM DU MUSEE;ADR;CP;ANNREOUV;FERME;SITWEB;FERMETURE ANNUELLE;PERIODE OUVERTURE;;;;;;;;;;
FRANCHE-COMTE;TERRITOIRE DE BELFORT;ETUEFFONT;Forge-Musee;2, Rue de Lamadeleine;90170;;NON;www.musees-des-techniques.org ou www.cc-pays-sous-vosgien.fr;;
GUADELOUPE;GUADELOUPE;BASSE TERRE -GUADELOUPE-;Musee de l'histoire de la Guadeloupe;Fort Louis Delgres;97100;;OUI;;;
GUADELOUPE;GUADELOUPE;GRAND-BOURG de MARIE-GALANTE;Ecomusee de Marie-Galante;Habitation Murat;97112;;OUI;;01/11-01/04;
GUADELOUPE;GUADELOUPE;LE MOULE;Musee Precolombien Edgar Clerc;440 Route de la Rosette;97160;;NON;www.cg971.fr/musees/clerc/index_edgar.htm;;
GUADELOUPE;GUADELOUPE;POINTE-A-PITRE;Musee Municipal Saint-John Perse;9, rue de Noziere;97110;;NON;www.sjperse.org/museesjp.htm;24/12,25/12;
GUADELOUPE;GUADELOUPE;POINTE-A-PITRE;Musee l'Herminier;Office du Tourisme 1 Centre Commercial Marina;97110;;OUI;;24/12,25/12,11/11;
GUADELOUPE;GUADELOUPE;POINTE-A-PITRE -GUADELOUPE;Musee Schoelcher;24, Rue Peynier;97110;;NON;www.cg971.fr/musees/schoelcher/index_schoecher.htm;24/12,25/12,11/11;
GUYANE;GUYANE;CAYENNE;Musee des Cultures Guyanaises;78, Rue Mme Paye;97300;;NON;www.mcg973.org;11/11,01/12-01/04;
GUYANE;GUYANE;CAYENNE - GUYANE;Musee Departemental Alexandre Franconie;1, Avenue du General-de-Gaulle;97300;;NON;;;
GUYANE;GUYANE;REGINA;Ecomusee Municipal d'Approuague-Kaw;Rue Gaston Monnerville Le Bourg;97390;;NON;;11/11,01/12-01/04;
ILE-DE-FRANCE;ESSONNE;BIEVRES;Musee Français de la Photographie;78, Rue de Paris;91570;;NON;www.museedelaphoto.fr;11/11,01/12-01/04;
ILE-DE-FRANCE;ESSONNE;BOUSSY-SAINT-ANTOINE;Musee Dunoyer de Segonzac;5, Place des Droits de l'Homme;91800;;NON;;;
ILE-DE-FRANCE;ESSONNE;BRUNOY;Musee Municipal Robert Dubois-Corneau;16, Rue du Reveillon;91800;;NON;www.brunoy.fr;01/01,01/04,25/12;
ILE-DE-FRANCE;ESSONNE;DOURDAN;Musee du Château;Place du General de Gaulle;91410;;NON;Site de la ville - www.mairie-dourdan.fr;24/12,25/12,11/11;
ILE-DE-FRANCE;ESSONNE;ETAMPES Cedex;Musee Intercommunal d'Etampes;Mairie d'Etampes B.P. 109;91152;;NON;site de la ville;;
ILE-DE-FRANCE;HAUTS DE SEINE;BOULOGNE-BILLANCOURT;Musee des Annees Trente;Espace Landowski 28, avenue Andre Morizet;92100;;NON;Site de l'association des amis -  www.annees30.com/;;
ILE-DE-FRANCE;HAUTS DE SEINE;BOULOGNE-BILLANCOURT;Musee-Jardin Paul Landowski;14, Rue Max Blondat;92100;;NON;;24/12,25/12;
ILE-DE-FRANCE;HAUTS DE SEINE;BOULOGNE-BILLANCOURT;Musee Belmondo et de la Sculpture Figurative du XXe siecle;Château Buchillot 14, Rue de l'Abreuvoir;92100;;NON;http://www.boulognebillancourt.com;11/11,01/12-01/04;
ILE-DE-FRANCE;HAUTS DE SEINE;BOULOGNE-BILLANCOURT;Musee Departemental Albert-Kahn;10-14, Rue du Port;92100;;NON;www.albert-kahn.fr;24/12,25/12,11/11;
ILE-DE-FRANCE;HAUTS DE SEINE;CLAMART;Fondation Arp;21, Rue des Châtaigniers;92140;;NON;www.fondationarp.org;;
ILE-DE-FRANCE;HAUTS DE SEINE;COLOMBES;Musee Municipal d'Art et d'Histoire;2, Rue Gabriel Peri;92700;;NON;Site de la ville - www.mairie-colombes.fr;01/01,01/04,25/12;
ILE-DE-FRANCE;HAUTS DE SEINE;COURBEVOIE;Musee Roybet Fould;Parc de Becon 178, Boulevard Saint Denis;92400;;NON;;;
ILE-DE-FRANCE;HAUTS DE SEINE;COURBEVOIE;Musee des Travaux Publics;Mairie de Courbevoie;92400;;OUI;Site de la ville;01/01,01/04,25/12;
ILE-DE-FRANCE;HAUTS DE SEINE;ISSY-LES-MOULINEAUX;Musee Français de la Carte a Jouer;16, Rue Auguste Gervais;92130;;NON;www.issy.com/musee;;
ILE-DE-FRANCE;HAUTS DE SEINE;MEUDON;Musee - Atelier Rodin;19, Avenue Auguste Rodin;92190;;NON;www.musee-rodin.fr;24/12,25/12;
ILE-DE-FRANCE;HAUTS DE SEINE;MEUDON;Musee d'Art et d'Histoire;11, Rue des Pierres;92190;;OUI;www.ville-meudon.fr/meudon/culture-et-patrimoine/copy5_of_structures-culturelles;;
ILE-DE-FRANCE;HAUTS DE SEINE;NEUILLY-SUR-SEINE;Musee des Automates;HOtel Arturo Lopez 12, Rue du Centre;92200;;OUI;;11/11,01/12-01/04;
ILE-DE-FRANCE;HAUTS DE SEINE;RUEIL-MALMAISON;Musee National des Châteaux de Malmaison et de Bois-Preau;Avenue du Château de Malmaison;92500;;NON;www.chateau-malmaison.fr;;
ILE-DE-FRANCE;HAUTS DE SEINE;RUEIL-MALMAISON Cedex;Musee Franco-Suisse;13, Boulevard Foch;92501;;NON;Site de la mairie : /www.mairie-rueilmalmaison.fr;;
ILE-DE-FRANCE;HAUTS DE SEINE;RUEIL-MALMAISON Cedex;Musee d'Histoire Locale - Memoire de la Ville;13, Boulevard Foch;92501;;NON;Site de la mairie : /www.mairie-rueilmalmaison.fr;;
ILE-DE-FRANCE;HAUTS DE SEINE;SAINT-CLOUD;Musee Municipal de Saint-Cloud;"""Jardin des Avelines"" 60, Rue Gounod";92210;;NON;www.ville-saint-cloud.fr/temps_libre/musee.htm;24/12,25/12,11/11;
ILE-DE-FRANCE;HAUTS DE SEINE;SCEAUX;Musee de l'Ile de France;;92330;;NON;www.chateau-sceaux.fr ou/www.domaine-de-sceaux.fr (site du conseil general) ou www.sceaux.fr;01/01,01/04,25/12;
ILE-DE-FRANCE;HAUTS DE SEINE;SEVRES;Sevres - Cite de la Ceramique;2, Place de la Manufacture;92310;;NON;www.sevresciteceramique.fr;11/11,01/12-01/04;
ILE-DE-FRANCE;HAUTS DE SEINE;SURESNES;Musee Rene Sordes;Avenue Charles de Gaulle Passerelle des Arts;92150;2018NON;NON;www.ville-suresnes.fr/indexfin.html;;
ILE-DE-FRANCE;PARIS;PARIS;Musee National du Moyen Age-Thermes de Cluny;6, Place Paul Painleve;75005;;NON;www.musee-moyenage.fr;;
ILE-DE-FRANCE;PARIS;PARIS;Musee de la Chasse et de la Nature;60, rue des Archives;75003;;NON;www.chassenature.org/;;
ILE-DE-FRANCE;PARIS;PARIS;Musee d'Art et d'Histoire du Judaïsme;HOtel de Saint-Aignan 71, Rue du Temple;75003;;NON;www.mahj.org;11/11,01/12-01/04;
ILE-DE-FRANCE;PARIS;PARIS;Musee National Picasso;HOtel Sale 5, Rue de Thorigny;75003;;OUI;www.musee-picasso.fr;;
ILE-DE-FRANCE;PARIS;PARIS;Musee Cognacq-Jay, Musee du XVIIIe siecle de la ville de Paris;8, Rue Elzevir;75003;;NON;www.cognacq-jay.paris.fr;;
ILE-DE-FRANCE;PARIS;PARIS;Musee Carnavalet-Histoire de Paris;23, Rue de Sevigne;75003;;NON;www.paris.fr/musees/musee_carnavalet;;
ILE-DE-FRANCE;PARIS;PARIS;Galerie d’entomologie (Museum national d'histoire naturelle);57, Rue Cuvier;75005;;OUI;www.mnhn.fr;;
ILE-DE-FRANCE;PARIS;PARIS;Musee de l'Assistance Publique - HOpitaux de Paris;10, Rue des Fosses Saint-Marcel;75005;;NON;www.aphp.fr;11/11,01/12-01/04;
ILE-DE-FRANCE;PARIS;PARIS;Galerie d'Anatomie Comparee et de Paleontologie (Museum d'Histoire Naturelle);Jardin des Plantes 2, rue Buffon;75005;;NON;www.mnhn.fr;24/12,25/12,11/11;
ILE-DE-FRANCE;PARIS;PARIS;Galerie de Botanique (Museum National National d'Histoire Naturelle);;75005;;OUI;;24/12,25/12;
ILE-DE-FRANCE;PARIS;PARIS;Galerie de Mineralogie et de Geologie (Museum d'Histoire Naturelle);Jardin des Plantes 36, Rue Geoffroy Saint-Hilaire;75005;2016OUI;OUI;www.mnhn.fr;;
ILE-DE-FRANCE;PARIS;PARIS;Maison de Victor Hugo;6, Place des Vosges;75004;;NON;www.musee-hugo.paris.fr;;
ILE-DE-FRANCE;PARIS;PARIS;Crypte Archeologique du Parvis Notre-Dame;7, Parvis Notre-Dame Place Jean Paul II;75004;;NON;http://crypte.paris.fr/;01/11-01/04;
ILE-DE-FRANCE;PARIS;PARIS;Musees Arts Decoratifs  Mode et du Textile;107, Rue de Rivoli;75001;;NON;www.lesartsdecoratifs.fr;24/12,25/12,11/11;
ILE-DE-FRANCE;PARIS;PARIS;Musee National Eugene Delacroix;6, Rue Furstenberg;75006;;NON;www.musee-delacroix.fr;;
ILE-DE-FRANCE;PARIS;PARIS;Grande Galerie de l'Evolution (Museum National d'Histoire Naturelle);Jardin des Plantes 36, rue Geoffroy Saint-Hilaire;75005;;NON;www.mnhn.fr;01/01,01/04,25/12;
ILE-DE-FRANCE;PARIS;PARIS;Musee de l'Armee;HOtel National des Invalides 129, rue de Grenelle;75007;;NON;www.invalides.org;11/11,01/12-01/04;
ILE-DE-FRANCE;PARIS;PARIS;Maison de Balzac;47, rue Raynouard;75016;;NON;www.balzac.paris.fr;01/11-01/04;
ILE-DE-FRANCE;PARIS;PARIS;Musee du Louvre;34, Quai du Louvre;75001;;NON;www.louvre.fr;;
ILE-DE-FRANCE;PARIS;PARIS;Musee National de la Marine;17, Place du Trocadero;75116;;NON;www.musee-marine.fr;;
ILE-DE-FRANCE;PARIS;PARIS;Memorial du Marechal Leclerc de Hauteclocque et de la Liberation de Paris - Musee Jean Moulin;23, Allee de la 2eme DB;75015;;NON;www.ml-leclerc-moulin.paris.fr;24/12,25/12,11/11;
ILE-DE-FRANCE;PARIS;PARIS;Musee National du Sport;93, avenue de France;75013;;NON;www.museedusport.fr;24/12,25/12,11/11;
ILE-DE-FRANCE;PARIS;PARIS;Musee Jean-Jacques Henner;43, Avenue de Villiers;75017;;NON;www.musee-henner.fr ou www.henner-intime.fr;;
ILE-DE-FRANCE;PARIS;PARIS;Musee de Montmartre;12, Rue Cortot;75018;;NON;www.museedemontmartre.fr;;
ILE-DE-FRANCE;PARIS;PARIS;Musee Bouchard;25, Rue de l'Yvette;75016;;OUI;www.musee-bouchard.com;;
ILE-DE-FRANCE;PARIS;PARIS;Musee Cernuschi, Musee des Arts de l'Asie de la ville de Paris;7, Avenue Velasquez;75008;;NON;www.cernuschi.paris.fr;11/11,01/12-01/04;
ILE-DE-FRANCE;PARIS;PARIS;Les Catacombes;1, avenue du Colonel Henri Rol-Tanguy (Place Denfert-Rochereau);75014;;NON;www.catacombes-de-paris.fr;;
ILE-DE-FRANCE;PARIS;PARIS;Musee Zadkine;100 bis, rue d'Assas;75006;;NON;www.zadkine.paris.fr;;
ILE-DE-FRANCE;PARIS;PARIS;Musee Galliera - Musee de la Mode de la ville de Paris;10, Avenue Pierre 1er de Serbie;75116;;OUI;www.galliera.paris.fr;;
ILE-DE-FRANCE;PARIS;PARIS;Etablissement Public du Musee d'Orsay;62, Rue de Lille;75007;;NON;www.musee-orsay.fr;;
ILE-DE-FRANCE;PARIS;PARIS;Musee National de la Legion d'Honneur et des Ordres de Chevalerie;2, Rue de la Legion d'Honneur;75007;;NON;www.musee-legiondhonneur.fr;01/01,01/04,25/12;
ILE-DE-FRANCE;PARIS;PARIS;Musee de la Musique;221, Avenue Jean-Jaures;75019;;NON;www.cite-musique.fr;01/11-01/04;
ILE-DE-FRANCE;PARIS;PARIS;Petit Palais, Musee des Beaux-Arts de la ville de Paris;Avenue Winston-Churchill;75008;;NON;www.petitpalais.paris.fr;01/11-01/04;
ILE-DE-FRANCE;PARIS;PARIS;Musee de la Vie Romantique;16, Rue Chaptal;75009;;NON;http://www.paris.fr/portail/Culture/Portal.lut?page_id=5851;;
ILE-DE-FRANCE;PARIS;PARIS;Musee de la Publicite (Les Arts Decoratifs);107, Rue de Rivoli;75010;;NON;www.museedelapub.org et www.lesartsdecoratifs.fr/;;
ILE-DE-FRANCE;PARIS;PARIS;Etablissement public de la Porte Doree - Aquarium Tropical;293, avenue Daumesnil;75012;;NON;www.aquarium-portedoree.fr;01/11-01/04;
ILE-DE-FRANCE;PARIS;PARIS;etablissement Public de la Porte Doree - Cite Nationale de l’Histoire de l’Immigration;Palais de la Porte Doree 293, avenue Daumesnil;75012;;NON;www.histoire-immigration.fr;;
ILE-DE-FRANCE;PARIS;PARIS;Musee Lenine;4 rue Marie-Rose;75014;;OUI;;;
ILE-DE-FRANCE;PARIS;PARIS;Musee Nissim de Camondo (Les Arts Decoratifs);63, Rue de Monceau;75008;;NON;www.lesartsdecoratifs.fr/;24/12,25/12;
ILE-DE-FRANCE;PARIS;PARIS;Musee Hebert;HOtel de Montmorency-Bours 85, Rue du Cherche Midi;75006;;OUI;;;
ILE-DE-FRANCE;PARIS;PARIS;Musee des Monuments Français;Palais de Chaillot 1, Place du Trocadero et du 11 Novembre;75116;;NON;www.citechaillot.fr;11/11,01/12-01/04;
ILE-DE-FRANCE;PARIS;PARIS;Institut du Monde Arabe;1, Rue des Fosses Saint-Bernard Place Mohammed V;;;NON;www.imarabe.org;24/12,25/12,11/11;
ILE-DE-FRANCE;PARIS;PARIS;Musees des Arts Decoratifs;107, Rue de Rivoli;75001;;NON;www.lesartsdecoratifs.fr/;;
ILE-DE-FRANCE;PARIS;PARIS;Musee National Auguste Rodin;HOtel Biron 77, rue de Varenne;75007;;NON;www.musee-rodin.fr;01/11-01/04;
ILE-DE-FRANCE;PARIS;PARIS;Musee National Gustave Moreau;14, Rue de la Rochefoucauld;75009;;NON;www.musee-moreau.fr;;
ILE-DE-FRANCE;PARIS;PARIS;Musee de la Franc-Maçonnerie;16, Rue Cadet;75009;;NON;www.museefm.org;;
ILE-DE-FRANCE;PARIS;PARIS;Musee National de L'Orangerie des Tuileries;Jardin des Tuileries;75001;;NON;www.musee-orangerie.fr;;
ILE-DE-FRANCE;PARIS;PARIS;Musee d'Art Moderne de la ville de Paris;11, Avenue du Pdt Wilson;75116;;NON;www.mam.paris.fr;;
ILE-DE-FRANCE;PARIS;PARIS;Musee d'Ennery;59, Avenue Foch;75116;;NON;www.guimet.fr;24/12,25/12;
ILE-DE-FRANCE;PARIS;PARIS;M.U.C.E.M. - Musee des ATP;6, Avenue du Mahatma Gandhi;75116;2015OUI;OUI;www.musee-europemediterranee.org;;
ILE-DE-FRANCE;PARIS;PARIS;Musee Bourdelle;16, Rue Antoine Bourdelle;75015;;NON;www.bourdelle.paris.fr;;
ILE-DE-FRANCE;PARIS;PARIS;Musee de l'Homme (Museum National d'Histoire Naturelle);Place du Trocadero;75116;2018OUI;OUI;www.mnhn.fr;24/12,25/12;
ILE-DE-FRANCE;PARIS;PARIS;Etablissement Public du Musee des Arts Asiatiques Guimet;6, Place d'Iena;75116;;NON;www.museeguimet.fr;;
ILE-DE-FRANCE;PARIS;PARIS cedex 03;Musee National des Techniques (Conservatoire National des Arts et Metiers);292, rue Saint-Martin;75141;;NON;www.arts-et-metiers.net;;
ILE-DE-FRANCE;PARIS;PARIS Cedex 04;Musee National d'Art Moderne (Centre National d'Art et de Culture Georges Pompidou);Place Georges Pompidou;75191;;NON;www.centrepompidou.fr;24/12,25/12;
ILE-DE-FRANCE;PARIS;PARIS Cedex 05;Musee du Service de Sante des Armees du Val-de-Grâce;1, Place Alphonse Laveran;75230;;NON;www.valdegrace.org;;
ILE-DE-FRANCE;PARIS;PARIS Cedex 06;Musee des Monnaies et des Medailles;11, Quai de Conti;75270;2017OUI;OUI;www.monnaiedeparis.fr;01/11-01/04;
ILE-DE-FRANCE;PARIS;PARIS cedex 07;Musee du Quai Branly;222, rue de l'Universite;75343;;NON;www.quaibranly.fr;;
ILE-DE-FRANCE;PARIS;PARIS Cedex 15;L'Adresse Musee de la Poste;34, Boulevard de Vaugirard;75731;;NON;www.museedelaposte.fr ou www.laposte.fr/musee;24/12,25/12;
ILE-DE-FRANCE;SEINE ET MARNE;BARBIZON;Musee Departemental de l'Ecole de Barbizon - Auberge Ganne;92, Grande Rue;77630;;NON;"www.seine-et-marne.fr (rubrique ""loisirs/musees departementaux)";;
ILE-DE-FRANCE;SEINE ET MARNE;CHELLES;Musee Municipal de Chelles Alfred Bonno;Place de la Republique;77500;;NON;www.chelles.fr/Culture/Musee-Alfred-Bonno;11/11,01/12-01/04;
ILE-DE-FRANCE;SEINE ET MARNE;CHELLES;Musee des Transports Urbains, Interurbains et Ruraux;1, Rue Gabriel de Mortillet;77500;;OUI;www.amtuir.org;24/12,25/12,11/11;
ILE-DE-FRANCE;SEINE ET MARNE;COULOMMIERS cedex;Musee Municipal des Capucins;HOtel de Ville B.P. 171;77527;;NON;www.tourisme77.fr ou www.coulommiers.fr;11/11,01/12-01/04;
ILE-DE-FRANCE;SEINE ET MARNE;COUPVRAY;Maison Natale de Louis Braille;13, Rue Louis-Braille;77700;;NON;www.braillenet.org/louis_braille/maisnat.htm;11/11,01/12-01/04;
ILE-DE-FRANCE;SEINE ET MARNE;CRECY-LA-CHAPELLE;Musee Municipal;;77580;;OUI;dgs@crecylachapelle.eu;;
ILE-DE-FRANCE;SEINE ET MARNE;FONTAINEBLEAU;Musee d'Art et d'Histoire Militaire;88, Rue St-Honore;77300;;OUI;;24/12,25/12;
ILE-DE-FRANCE;SEINE ET MARNE;FONTAINEBLEAU;Musee du Château de Fontainebleau;Château de Fontainebleau;77300;;NON;www.châteaudefontainebleau.fr;11/11,01/12-01/04;
ILE-DE-FRANCE;SEINE ET MARNE;LAGNY-SUR-MARNE;Musee Gatien Bonnet;8, Cour Pierre Herbin;77405;;NON;Site de la ville;01/11-01/04;
ILE-DE-FRANCE;SEINE ET MARNE;LE MEE-SUR-SEINE;Musee Henri Chapu;937, Rue Chapu;77350;;NON;Site de la ville;;
ILE-DE-FRANCE;SEINE ET MARNE;MEAUX;Musee Bossuet;5, Place Charles de Gaulle;77100;;NON;site de la ville - www.ville-meaux.fr;11/11,01/12-01/04;
ILE-DE-FRANCE;SEINE ET MARNE;MEAUX;Musee de la Grande Guerre du Pays de Meaux;Rue Lazare Ponticelli;77100;;OUI;www.museedelagrandeguerre.eu;01/11-01/04;
ILE-DE-FRANCE;SEINE ET MARNE;MELUN;Musee de la Gendarmerie;Ecole des Officiers de la Gendarmerie Nationale 8, rue Emile Leclerc;77017;2016OUI;OUI;www.servicehistorique.sga.defense.gouv.fr;24/12,25/12,11/11;
ILE-DE-FRANCE;SEINE ET MARNE;MELUN Cedex;Musee de Melun;5, Rue du Franc Murier;77008;;NON;Site de la ville : www.ville-melun.fr;11/11,01/12-01/04;
ILE-DE-FRANCE;SEINE ET MARNE;MORET-SUR-LOING;Musee Municipal;Place de Samois;77250;;NON;http://www.ville-moret-sur-loing.fr;24/12,25/12;
ILE-DE-FRANCE;SEINE ET MARNE;NEMOURS;Musee Departemental de Prehistoire d'Ile de France;48, Avenue Etienne Dailly;77140;;NON;www.musee-prehistoire-idf.fr;;
ILE-DE-FRANCE;SEINE ET MARNE;NEMOURS;Château-musee de Nemours;Rue Gautier 1er;77140;;NON;Site de la ville - www.ville-nemours.fr;;
ILE-DE-FRANCE;SEINE ET MARNE;PROVINS;Musee de Provins et du Provinois;7, rue du Palais;77160;;NON;Site de la ville : www.mairie-provins.fr;;
ILE-DE-FRANCE;SEINE ET MARNE;SAINT-CYR-SUR-MORIN;Musee des Pays de Seine-et-Marne;17, Avenue de la Ferte-Sous-Jouarre;77750;;NON;"Site du conseil general - www.seine-et-marne.fr - rubrique ""loisirs""";01/11-01/04;
ILE-DE-FRANCE;SEINE ET MARNE;SAVIGNY-LE-TEMPLE;Ecomusee;Ferme de CouleOUIn Place Georges Henri Riviere;77176;;NON;Site de la ville www.savigny-le-temple.fr;01/11-01/04;
ILE-DE-FRANCE;SEINE ET MARNE;VULAINES-SUR-SEINE;Musee departemental Stephane Mallarme;Pont de Valvins 4, Promenade Stephane Mallarme;77870;;NON;"www.weine-et-marne.fr (rubrique ""loisirs/musees departementaux)";01/01,01/04,25/12;
ILE-DE-FRANCE;SEINE SAINT-DENIS;LE BOURGET Cedex;Musee de l'Air et de l'Espace;Aeroport de Paris - Le Bourget BP 173;93352;;NON;www.museeairespace.fr;01/01,01/04,25/12;
ILE-DE-FRANCE;SEINE SAINT-DENIS;LIVRY-GARGAN;Musee Municipal;Avenue du Consul General Nordling;93190;;NON;www.mairie-livrygargan.fr/rubrique culture loisirs;;
ILE-DE-FRANCE;SEINE SAINT-DENIS;MONTREUIL-SOUS-BOIS;Musee de l'Histoire Vivante;31, Boulevard Theophile Sueur;93100;;NON;www.museehistoirevivante.com;;
ILE-DE-FRANCE;SEINE SAINT-DENIS;SAINT-DENIS;Musee d'Art et d'Histoire;22 bis, rue Gabriel Peri;93200;;NON;www.musee-saint-denis.fr;;
ILE-DE-FRANCE;SEINE SAINT-DENIS;SAINT-OUEN;Musee Municipal;12, Rue Albert Dhalenne;93400;;OUI;;01/11-01/04;
ILE-DE-FRANCE;VAL D'OISE;ARGENTEUIL;Musee du Vieil Argenteuil;5, rue Pierre-Guienne;95100;;OUI;Site de la ville - www.argenteuil.fr/article.php3?id_article=529;24/12,25/12;
ILE-DE-FRANCE;VAL D'OISE;ECOUEN;Musee de la Renaissance - Château d'Ecouen;Château;95440;;NON;www.musee-renaissance.fr ou www.musee-château-ecouen.fr;11/11,01/12-01/04;
ILE-DE-FRANCE;VAL D'OISE;GUIRY-EN-VEXIN;Musee Archeologique du Val d'Oise;Place du Château;95450;;NON;www.valdoise.fr/content/content15651.html;;
ILE-DE-FRANCE;VAL D'OISE;L'ISLE-ADAM;Musee d'Art et d'Histoire Louis Senlecq;46, Grande Rue;95290;;OUI;http://musee.ville-isle-adam.fr/index.html;24/12,25/12;
ILE-DE-FRANCE;VAL D'OISE;LOUVRES;ARCHEA - Musee Intercommunal d'Histoire et d'Archeologie;56, Rue de Paris;95380;;NON;www.archea-roissyportedefrance.fr;;
ILE-DE-FRANCE;VAL D'OISE;MONTMORENCY;Musee jean-Jacques Rousseau;5, Rue Jean-Jacques Rousseau;95160;;NON;/www.ville-montmorency.fr;24/12,25/12,11/11;
ILE-DE-FRANCE;VAL D'OISE;PONTOISE;Musee Tavet Delacour;4, Rue Lemercier;95300;;NON;Site de la ville - www.ville-Pontoise.fr;11/11,01/12-01/04;
ILE-DE-FRANCE;VAL D'OISE;PONTOISE;Musee Camille Pissarro;17, Rue du Château;95300;;NON;www.ville-pontoise.fr;01/01,01/04,25/12;
ILE-DE-FRANCE;VAL DE MARNE;BRY-SUR-MARNE;Musee Adrien Mentienne;1, Grande Rue Charles de Gaulle;94360;;OUI;http://www.bry94.fr/bry/71.htm;11/11,01/12-01/04;
ILE-DE-FRANCE;VAL DE MARNE;CHAMPIGNY-SUR-MARNE Cedex;Musee de la Resistance Nationale;Parc Vercors 88, Avenue Marx Dormoy - B.P. 135 B.P. 135;94501;;NON;www.musee-resistance.com;01/11-01/04;
ILE-DE-FRANCE;VAL DE MARNE;FRESNES;Ecomusee du Val de Bievre;Ferme de Cottinville 41, rue Maurice Tenine;94260;;NON;www.ecomusee-valdebievre.fr;24/12,25/12,11/11;
ILE-DE-FRANCE;VAL DE MARNE;LA VARENNE-SAINT-HILAIRE;Musee de Saint-Maur - Villa Medicis;5, Rue Saint-Hilaire;94210;;NON;www.saint-maur.com/musee/musee.htm;;
ILE-DE-FRANCE;VAL DE MARNE;MAISONS-ALFORT Cedex;Musee Fragonard;Ecole Nationale Veterinaire d'Alfort 7, Avenue du Gal de Gaulle;94704;;NON;http://musee.vet-alfort.fr/;01/11-01/04;
ILE-DE-FRANCE;VAL DE MARNE;NOGENT-SUR-MARNE;Musee de Nogent-Sur-Marne;36, Boulevard Gallieni;94130;;NON;www.musee-nogentsurmarne.fr;;
ILE-DE-FRANCE;VAL DE MARNE;VILLIERS-SUR-MARNE;Musee Emile Jean;31, rue Louis-Lenoir;94350;;NON;www.mairie-villiers94.com/francais/vie_quoti/vie_quot_culture7.php;;
ILE-DE-FRANCE;VAL DE MARNE;VITRY SUR SEINE Cedex;Musee d'Art Contemporain du Val-de-Marne;Place de la Liberation B.P. 147;94404;;NON;www.macval.fr;11/11,01/12-01/04;
ILE-DE-FRANCE;YVELINES;CONFLANS-SAINTE-HONORINE;Musee de la Batellerie;Château du Prieure 3, Place Gevelot;78700;;NON;www.mairie-conflans-sainte-honorine.fr;;
ILE-DE-FRANCE;YVELINES;JOUY-EN-JOSAS;Musee de la Toile de Jouy;Château de l'Eglantine 54, rue Charles de Gaulle;78350;;NON;www.museedelatoiledejouy.fr;01/11-01/04;
ILE-DE-FRANCE;YVELINES;LOUVECIENNES;Musee-Promenade de Marly-Le Roi /Louveciennes;La Grille Royale Parc de Marly;78430;;NON;www.musee-promenade.fr;;
ILE-DE-FRANCE;YVELINES;MAGNY-LES-HAMEAUX;Musee National de Port Royal des Champs;Route des Granges;78114;;NON;http://www.port-royal-des-champs.eu;;
ILE-DE-FRANCE;YVELINES;MANTES-LA-JOLIE;Musee de l'HOtel-Dieu;1, Rue Thiers;78200;;NON;http://musee.ville-mantes-la-jolie.com;;
ILE-DE-FRANCE;YVELINES;MAULE;Musee Victor Aubert;24, rue Quincampoix;78580;;NON;http://museeaubertmaule.free.fr;11/11,01/12-01/04;
ILE-DE-FRANCE;YVELINES;MEDAN;Musee Zola-Dreyfus;26, Rue Pasteur;78670;2016OUI;OUI;www.maisonzola-museedreyfus.com;;
ILE-DE-FRANCE;YVELINES;MONTFORT-L'AMAURY;Musee-Maison Maurice Ravel;5, Rue Maurice Ravel;78490;;NON;www.ville-montfort-l-amaury.fr;;
ILE-DE-FRANCE;YVELINES;POISSY;Musee du Jouet Pierre Pinel;1, Enclos de l'Abbaye;78300;;NON;site de la ville;01/01,01/04,25/12;
ILE-DE-FRANCE;YVELINES;POISSY;Musee d'Art et d'Histoire;12, Rue Saint-Louis;78300;;OUI;Site de la ville;01/11-01/04;
ILE-DE-FRANCE;YVELINES;RAMBOUILLET;Musee Rambolitrain;4, Place Jeanne d'Arc;78120;;NON;www.rambolitrain.fr;24/12,25/12,11/11;
ILE-DE-FRANCE;YVELINES;SAINT-GERMAIN-EN-LAYE;Musee Municipal - Collections Paul et Andre Vera;Espace Vera 2, Rue Henri IV;78100;;OUI;Site de la ville;24/12,25/12,11/11;
ILE-DE-FRANCE;YVELINES;SAINT-GERMAIN-EN-LAYE Cedex;Musee Departemental Maurice Denis;2 bis, Rue Maurice Denis B.P. 60222;78102;;NON;www.musee-mauricedenis.fr;24/12,25/12,11/11;
ILE-DE-FRANCE;YVELINES;SAINT-GERMAIN-EN-LAYE Cedex;Musee d'Archeologie Nationale (des origines a l'an mille) - Château de st-Germain-en-Laye;Château Place Charles de Gaulle;78105;;NON;www.musee-antiquitesnationales.fr -www.musee-archeologienationale.fr;24/12,25/12;
ILE-DE-FRANCE;YVELINES;SAINT-QUENTIN-YVELINES Cedex;Musee de la Ville;B.P. 46;78185;;NON;www.museedelaville.agglo-sqy.fr;;
ILE-DE-FRANCE;YVELINES;ST-REMY-LES-CHEVREUSE;Collections de la Fondation de Coubertin;Domaine de Coubertin;78470;;NON;www.coubertin.fr;;
ILE-DE-FRANCE;YVELINES;VERSAILLES;Musee Lambinet;54, Boulevard de la Reine;78000;;NON;www.musee-lambinet.com;24/12,25/12,11/11;
ILE-DE-FRANCE;YVELINES;VERSAILLES Cedex;Etablissement Public du Musee et du Domaine National de Versailles;R.P. 834;78008;;NON;www.chateauversailles.fr;24/12,25/12;
LANGUEDOC-ROUSSILLON;AUDE;BRAM;"Musee Municipal ""Eburomagus Musee Archeologique""";2, Avenue du Razes;11150;;NON;www.eburomagus.com;01/01,01/04,25/12;
LANGUEDOC-ROUSSILLON;AUDE;CARCASSONNE;Musee des Beaux-Arts;1, Rue de Verdun;11000;;NON;Site de la ville;;
LANGUEDOC-ROUSSILLON;AUDE;CASTELNAUDARY Cedex;Musee Archeologique du Lauragais;Rampe du Presidial B.P. 1100;11491;;NON;http://www.ville-castelnaudary.fr;;
LANGUEDOC-ROUSSILLON;AUDE;LASTOURS;Musee Municipal;Mairie;11600;;OUI;;01/01,01/04,25/12;
LANGUEDOC-ROUSSILLON;AUDE;LIMOUX Cedex;Musee Petiet;Promenade du Tivoli B.P. 88;11304;;NON;www.limoux.fr/fr/tourisme/musee_petiet.html;;
LANGUEDOC-ROUSSILLON;AUDE;NARBONNE cedex;Musee Archeologique;B.P. 823;11108;;NON;www.mairie-narbonne.fr;24/12,25/12,11/11;
LANGUEDOC-ROUSSILLON;AUDE;NARBONNE Cedex;Musee d'Art et d'Histoire;B.P. 823;11108;;NON;www.mairie-narbonne.ff;11/11,01/12-01/04;
LANGUEDOC-ROUSSILLON;AUDE;SALLELES D'AUDE;Musee Archeologique;Allee des Potiers;11590;;NON;http://culture.legrandnarbonne.com/421-amphoralis.html - www.amphoralis.com;;
LANGUEDOC-ROUSSILLON;AUDE;SIGEAN;Musee des Corbieres;Place de la Liberation;11130;;NON;www.sigean.fr - site de la ville;11/11,01/12-01/04;
LANGUEDOC-ROUSSILLON;GARD;ALES;Musee du Colombier;Rue Jean Mayodon;30100;;NON;site de la ville - www.ville-ales.fr;24/12,25/12,11/11;
LANGUEDOC-ROUSSILLON;GARD;ALES;Musee-Bibliotheque Pierre-Andre BenoIt;Rue de Brouzen POle culturel de Rochebelle;30100;;NON;site de la ville - www.ville-ales.fr;24/12,25/12;
LANGUEDOC-ROUSSILLON;GARD;BAGNOLS-SUR-CEZE;Musee Albert Andre;HOtel de ville place Mallet;30200;;NON;Site dela ville ou Site du conseil general;;
LANGUEDOC-ROUSSILLON;GARD;BAGNOLS-SUR-CEZE;Musee Leon Alegre;24, avenue Paul Langevin;30200;;NON;Site de la ville ou site du conseil general;01/01,01/04,25/12;
LANGUEDOC-ROUSSILLON;GARD;BEAUCAIRE;Musee Municipal de la Vignasse;Mairie Rue de l'HOtel de ville;30300;;NON;www.beaucaire.fr/spip.php?article65;;
LANGUEDOC-ROUSSILLON;GARD;LE VIGAN;Musee Cevenol;1, Rue des Calquieres;30120;;NON;www.museecevenol.com;;
LANGUEDOC-ROUSSILLON;GARD;NIMES;Musee Archeologique;13, Boulevard Amiral Courbet;30000;;NON;www.nimes.fr/index.php?id=280;;
LANGUEDOC-ROUSSILLON;GARD;NIMES;Musee du Vieux NImes;Place aux Herbes;30000;;NON;www.nimes.fr/index.php?id=283;;
LANGUEDOC-ROUSSILLON;GARD;NIMES;Musee des Cultures Taurines;6, Rue Alexandre Ducros;30000;;NON;http://www.nimes.fr/index.php?id=282;24/12,25/12;
LANGUEDOC-ROUSSILLON;GARD;NIMES Cedex 1;Carre d'Art Musee d'Art Contemporain de NImes;Place de la Maison Carree;30031;;NON;www.carreartmusee.nimes.fr;24/12,25/12,11/11;
LANGUEDOC-ROUSSILLON;GARD;NIMES Cedex 9;Musee d'Histoire Naturelle et de Prehistoire;13 Bis, Bd Amiral Courbet;30033;;NON;site de la ville - www.nimes.fr;;
LANGUEDOC-ROUSSILLON;GARD;NIMES Cedex 9;Musee des Beaux-Arts;Rue Cite Foulc;30033;;NON;www.nimes.fr;11/11,01/12-01/04;
LANGUEDOC-ROUSSILLON;GARD;PONT-SAINT-ESPRIT;Musee Paul Raymond;Place de l'Ancienne Mairie;30130;;NON;;;
LANGUEDOC-ROUSSILLON;GARD;PONT-SAINT-ESPRIT;Musee Departemental d'Art Sacre;Maison des Chevaliers 2, Rue Saint-Jacques;30130;;NON;Site du conseil general;24/12,25/12,11/11;
LANGUEDOC-ROUSSILLON;GARD;SAINT-GILLES-DU-GARD;Musee de la Maison Romane;Place de la Maison Romane B.P. 77;30800;;NON;Site de la ville - www.ville-saint-gilles.fr;01/11-01/04;
LANGUEDOC-ROUSSILLON;GARD;SAINT-JEAN DU GARD;Musee des Vallees Cevenoles;B.P. 08;30270;;NON;www.museedescevennes.com;;
LANGUEDOC-ROUSSILLON;GARD;UZES cedex;Musee Municipal Georges Borias;Ancien Evêche BP 103;30701;;NON;http://uzesmusee.blogspot.fr/ ou http://www.uzes-tourisme.com/sitefr/musees/borias.htm;01/01,01/04,25/12;
